No.     Time           Source                Destination           Protocol Length Info
      1 0.000000       149.154.167.50        192.168.0.103         SSL      171    Continuation Data

Frame 1: 171 bytes on wire (1368 bits), 171 bytes captured (1368 bits) on interface en0, id 0
Ethernet II, Src: Tp-LinkT_55:94:64 (14:cc:20:55:94:64), Dst: Apple_d6:45:86 (a4:d1:8c:d6:45:86)
Internet Protocol Version 4, Src: 149.154.167.50, Dst: 192.168.0.103
Transmission Control Protocol, Src Port: 443, Dst Port: 51371, Seq: 1, Ack: 1, Len: 105
Transport Layer Security

No.     Time           Source                Destination           Protocol Length Info
      2 0.000104       192.168.0.103         149.154.167.50        TCP      66     51371 → 443 [ACK] Seq=1 Ack=106 Win=2046 Len=0 TSval=2120438226 TSecr=1033610258

Frame 2: 66 bytes on wire (528 bits), 66 bytes captured (528 bits) on interface en0, id 0
Ethernet II, Src: Apple_d6:45:86 (a4:d1:8c:d6:45:86), Dst: Tp-LinkT_55:94:64 (14:cc:20:55:94:64)
Internet Protocol Version 4, Src: 192.168.0.103, Dst: 149.154.167.50
Transmission Control Protocol, Src Port: 51371, Dst Port: 443, Seq: 1, Ack: 106, Len: 0

No.     Time           Source                Destination           Protocol Length Info
      3 0.584144       149.154.167.50        192.168.0.103         SSL      155    Continuation Data

Frame 3: 155 bytes on wire (1240 bits), 155 bytes captured (1240 bits) on interface en0, id 0
Ethernet II, Src: Tp-LinkT_55:94:64 (14:cc:20:55:94:64), Dst: Apple_d6:45:86 (a4:d1:8c:d6:45:86)
Internet Protocol Version 4, Src: 149.154.167.50, Dst: 192.168.0.103
Transmission Control Protocol, Src Port: 443, Dst Port: 51371, Seq: 106, Ack: 1, Len: 89
Transport Layer Security

No.     Time           Source                Destination           Protocol Length Info
      4 0.584273       192.168.0.103         149.154.167.50        TCP      66     51371 → 443 [ACK] Seq=1 Ack=195 Win=2046 Len=0 TSval=2120438809 TSecr=1033610847

Frame 4: 66 bytes on wire (528 bits), 66 bytes captured (528 bits) on interface en0, id 0
Ethernet II, Src: Apple_d6:45:86 (a4:d1:8c:d6:45:86), Dst: Tp-LinkT_55:94:64 (14:cc:20:55:94:64)
Internet Protocol Version 4, Src: 192.168.0.103, Dst: 149.154.167.50
Transmission Control Protocol, Src Port: 51371, Dst Port: 443, Seq: 1, Ack: 195, Len: 0

No.     Time           Source                Destination           Protocol Length Info
      5 2.122880       64.233.162.189        192.168.0.103         TLSv1.2  118    Application Data

Frame 5: 118 bytes on wire (944 bits), 118 bytes captured (944 bits) on interface en0, id 0
Ethernet II, Src: Tp-LinkT_55:94:64 (14:cc:20:55:94:64), Dst: Apple_d6:45:86 (a4:d1:8c:d6:45:86)
Internet Protocol Version 4, Src: 64.233.162.189, Dst: 192.168.0.103
Transmission Control Protocol, Src Port: 443, Dst Port: 51348, Seq: 1, Ack: 1, Len: 52
Transport Layer Security

No.     Time           Source                Destination           Protocol Length Info
      6 2.123008       192.168.0.103         64.233.162.189        TCP      66     51348 → 443 [ACK] Seq=1 Ack=53 Win=2047 Len=0 TSval=2120440346 TSecr=2813286787

Frame 6: 66 bytes on wire (528 bits), 66 bytes captured (528 bits) on interface en0, id 0
Ethernet II, Src: Apple_d6:45:86 (a4:d1:8c:d6:45:86), Dst: Tp-LinkT_55:94:64 (14:cc:20:55:94:64)
Internet Protocol Version 4, Src: 192.168.0.103, Dst: 64.233.162.189
Transmission Control Protocol, Src Port: 51348, Dst Port: 443, Seq: 1, Ack: 53, Len: 0

No.     Time           Source                Destination           Protocol Length Info
      7 3.432233       192.168.0.103         192.168.0.1           DNS      70     Standard query 0x727b A www.ust.hk

Frame 7: 70 bytes on wire (560 bits), 70 bytes captured (560 bits) on interface en0, id 0
Ethernet II, Src: Apple_d6:45:86 (a4:d1:8c:d6:45:86), Dst: Tp-LinkT_55:94:64 (14:cc:20:55:94:64)
Internet Protocol Version 4, Src: 192.168.0.103, Dst: 192.168.0.1
User Datagram Protocol, Src Port: 54663, Dst Port: 53
Domain Name System (query)

No.     Time           Source                Destination           Protocol Length Info
      8 3.469855       192.168.0.1           192.168.0.103         DNS      86     Standard query response 0x727b A www.ust.hk A 143.89.14.1

Frame 8: 86 bytes on wire (688 bits), 86 bytes captured (688 bits) on interface en0, id 0
Ethernet II, Src: Tp-LinkT_55:94:64 (14:cc:20:55:94:64), Dst: Apple_d6:45:86 (a4:d1:8c:d6:45:86)
Internet Protocol Version 4, Src: 192.168.0.1, Dst: 192.168.0.103
User Datagram Protocol, Src Port: 53, Dst Port: 54663
Domain Name System (response)

No.     Time           Source                Destination           Protocol Length Info
      9 3.470940       192.168.0.103         143.89.14.1           ICMP     98     Echo (ping) request  id=0x9563, seq=0/0, ttl=64 (no response found!)

Frame 9: 98 bytes on wire (784 bits), 98 bytes captured (784 bits) on interface en0, id 0
Ethernet II, Src: Apple_d6:45:86 (a4:d1:8c:d6:45:86), Dst: Tp-LinkT_55:94:64 (14:cc:20:55:94:64)
Internet Protocol Version 4, Src: 192.168.0.103, Dst: 143.89.14.1
Internet Control Message Protocol

No.     Time           Source                Destination           Protocol Length Info
     10 4.473222       192.168.0.103         143.89.14.1           ICMP     98     Echo (ping) request  id=0x9563, seq=1/256, ttl=64 (no response found!)

Frame 10: 98 bytes on wire (784 bits), 98 bytes captured (784 bits) on interface en0, id 0
Ethernet II, Src: Apple_d6:45:86 (a4:d1:8c:d6:45:86), Dst: Tp-LinkT_55:94:64 (14:cc:20:55:94:64)
Internet Protocol Version 4, Src: 192.168.0.103, Dst: 143.89.14.1
Internet Control Message Protocol

No.     Time           Source                Destination           Protocol Length Info
     11 4.538805       192.168.0.103         35.186.224.47         TLSv1.2  101    Application Data

Frame 11: 101 bytes on wire (808 bits), 101 bytes captured (808 bits) on interface en0, id 0
Ethernet II, Src: Apple_d6:45:86 (a4:d1:8c:d6:45:86), Dst: Tp-LinkT_55:94:64 (14:cc:20:55:94:64)
Internet Protocol Version 4, Src: 192.168.0.103, Dst: 35.186.224.47
Transmission Control Protocol, Src Port: 51332, Dst Port: 443, Seq: 1, Ack: 1, Len: 35
Transport Layer Security

No.     Time           Source                Destination           Protocol Length Info
     12 4.563515       35.186.224.47         192.168.0.103         TCP      66     443 → 51332 [ACK] Seq=1 Ack=36 Win=245 Len=0 TSval=2061629199 TSecr=2120442761

Frame 12: 66 bytes on wire (528 bits), 66 bytes captured (528 bits) on interface en0, id 0
Ethernet II, Src: Tp-LinkT_55:94:64 (14:cc:20:55:94:64), Dst: Apple_d6:45:86 (a4:d1:8c:d6:45:86)
Internet Protocol Version 4, Src: 35.186.224.47, Dst: 192.168.0.103
Transmission Control Protocol, Src Port: 443, Dst Port: 51332, Seq: 1, Ack: 36, Len: 0

No.     Time           Source                Destination           Protocol Length Info
     13 4.580271       35.186.224.47         192.168.0.103         TLSv1.2  97     Application Data

Frame 13: 97 bytes on wire (776 bits), 97 bytes captured (776 bits) on interface en0, id 0
Ethernet II, Src: Tp-LinkT_55:94:64 (14:cc:20:55:94:64), Dst: Apple_d6:45:86 (a4:d1:8c:d6:45:86)
Internet Protocol Version 4, Src: 35.186.224.47, Dst: 192.168.0.103
Transmission Control Protocol, Src Port: 443, Dst Port: 51332, Seq: 1, Ack: 36, Len: 31
Transport Layer Security

No.     Time           Source                Destination           Protocol Length Info
     14 4.580384       192.168.0.103         35.186.224.47         TCP      66     51332 → 443 [ACK] Seq=36 Ack=32 Win=2047 Len=0 TSval=2120442801 TSecr=2061629216

Frame 14: 66 bytes on wire (528 bits), 66 bytes captured (528 bits) on interface en0, id 0
Ethernet II, Src: Apple_d6:45:86 (a4:d1:8c:d6:45:86), Dst: Tp-LinkT_55:94:64 (14:cc:20:55:94:64)
Internet Protocol Version 4, Src: 192.168.0.103, Dst: 35.186.224.47
Transmission Control Protocol, Src Port: 51332, Dst Port: 443, Seq: 36, Ack: 32, Len: 0

No.     Time           Source                Destination           Protocol Length Info
     15 5.295349       149.154.167.50        192.168.0.103         SSL      155    Continuation Data

Frame 15: 155 bytes on wire (1240 bits), 155 bytes captured (1240 bits) on interface en0, id 0
Ethernet II, Src: Tp-LinkT_55:94:64 (14:cc:20:55:94:64), Dst: Apple_d6:45:86 (a4:d1:8c:d6:45:86)
Internet Protocol Version 4, Src: 149.154.167.50, Dst: 192.168.0.103
Transmission Control Protocol, Src Port: 443, Dst Port: 51371, Seq: 195, Ack: 1, Len: 89
Transport Layer Security

No.     Time           Source                Destination           Protocol Length Info
     16 5.295475       192.168.0.103         149.154.167.50        TCP      66     51371 → 443 [ACK] Seq=1 Ack=284 Win=2046 Len=0 TSval=2120443516 TSecr=1033615590

Frame 16: 66 bytes on wire (528 bits), 66 bytes captured (528 bits) on interface en0, id 0
Ethernet II, Src: Apple_d6:45:86 (a4:d1:8c:d6:45:86), Dst: Tp-LinkT_55:94:64 (14:cc:20:55:94:64)
Internet Protocol Version 4, Src: 192.168.0.103, Dst: 149.154.167.50
Transmission Control Protocol, Src Port: 51371, Dst Port: 443, Seq: 1, Ack: 284, Len: 0

No.     Time           Source                Destination           Protocol Length Info
     17 5.296637       192.168.0.103         149.154.167.50        SSL      347    Continuation Data

Frame 17: 347 bytes on wire (2776 bits), 347 bytes captured (2776 bits) on interface en0, id 0
Ethernet II, Src: Apple_d6:45:86 (a4:d1:8c:d6:45:86), Dst: Tp-LinkT_55:94:64 (14:cc:20:55:94:64)
Internet Protocol Version 4, Src: 192.168.0.103, Dst: 149.154.167.50
Transmission Control Protocol, Src Port: 51371, Dst Port: 443, Seq: 1, Ack: 284, Len: 281
Transport Layer Security

No.     Time           Source                Destination           Protocol Length Info
     18 5.349250       149.154.167.50        192.168.0.103         TCP      70     443 → 51371 [PSH, ACK] Seq=284 Ack=282 Win=32768 Len=4 TSval=1033615674 TSecr=2120443517 [TCP segment of a reassembled PDU]

Frame 18: 70 bytes on wire (560 bits), 70 bytes captured (560 bits) on interface en0, id 0
Ethernet II, Src: Tp-LinkT_55:94:64 (14:cc:20:55:94:64), Dst: Apple_d6:45:86 (a4:d1:8c:d6:45:86)
Internet Protocol Version 4, Src: 149.154.167.50, Dst: 192.168.0.103
Transmission Control Protocol, Src Port: 443, Dst Port: 51371, Seq: 284, Ack: 282, Len: 4

No.     Time           Source                Destination           Protocol Length Info
     19 5.349386       192.168.0.103         149.154.167.50        TCP      66     51371 → 443 [ACK] Seq=282 Ack=288 Win=2047 Len=0 TSval=2120443569 TSecr=1033615674

Frame 19: 66 bytes on wire (528 bits), 66 bytes captured (528 bits) on interface en0, id 0
Ethernet II, Src: Apple_d6:45:86 (a4:d1:8c:d6:45:86), Dst: Tp-LinkT_55:94:64 (14:cc:20:55:94:64)
Internet Protocol Version 4, Src: 192.168.0.103, Dst: 149.154.167.50
Transmission Control Protocol, Src Port: 51371, Dst Port: 443, Seq: 282, Ack: 288, Len: 0

No.     Time           Source                Destination           Protocol Length Info
     20 5.425863       149.154.167.50        192.168.0.103         SSL      734    Continuation Data

Frame 20: 734 bytes on wire (5872 bits), 734 bytes captured (5872 bits) on interface en0, id 0
Ethernet II, Src: Tp-LinkT_55:94:64 (14:cc:20:55:94:64), Dst: Apple_d6:45:86 (a4:d1:8c:d6:45:86)
Internet Protocol Version 4, Src: 149.154.167.50, Dst: 192.168.0.103
Transmission Control Protocol, Src Port: 443, Dst Port: 51371, Seq: 288, Ack: 282, Len: 668
[2 Reassembled TCP Segments (672 bytes): #18(4), #20(668)]
Transport Layer Security

No.     Time           Source                Destination           Protocol Length Info
     21 5.425982       192.168.0.103         149.154.167.50        TCP      66     51371 → 443 [ACK] Seq=282 Ack=956 Win=2037 Len=0 TSval=2120443645 TSecr=1033615751

Frame 21: 66 bytes on wire (528 bits), 66 bytes captured (528 bits) on interface en0, id 0
Ethernet II, Src: Apple_d6:45:86 (a4:d1:8c:d6:45:86), Dst: Tp-LinkT_55:94:64 (14:cc:20:55:94:64)
Internet Protocol Version 4, Src: 192.168.0.103, Dst: 149.154.167.50
Transmission Control Protocol, Src Port: 51371, Dst Port: 443, Seq: 282, Ack: 956, Len: 0

No.     Time           Source                Destination           Protocol Length Info
     22 5.427999       192.168.0.103         149.154.167.50        SSL      267    Continuation Data

Frame 22: 267 bytes on wire (2136 bits), 267 bytes captured (2136 bits) on interface en0, id 0
Ethernet II, Src: Apple_d6:45:86 (a4:d1:8c:d6:45:86), Dst: Tp-LinkT_55:94:64 (14:cc:20:55:94:64)
Internet Protocol Version 4, Src: 192.168.0.103, Dst: 149.154.167.50
Transmission Control Protocol, Src Port: 51371, Dst Port: 443, Seq: 282, Ack: 956, Len: 201
Transport Layer Security

No.     Time           Source                Destination           Protocol Length Info
     23 5.478457       192.168.0.103         143.89.14.1           ICMP     98     Echo (ping) request  id=0x9563, seq=2/512, ttl=64 (no response found!)

Frame 23: 98 bytes on wire (784 bits), 98 bytes captured (784 bits) on interface en0, id 0
Ethernet II, Src: Apple_d6:45:86 (a4:d1:8c:d6:45:86), Dst: Tp-LinkT_55:94:64 (14:cc:20:55:94:64)
Internet Protocol Version 4, Src: 192.168.0.103, Dst: 143.89.14.1
Internet Control Message Protocol

No.     Time           Source                Destination           Protocol Length Info
     24 5.480660       149.154.167.50        192.168.0.103         TCP      70     443 → 51371 [PSH, ACK] Seq=956 Ack=483 Win=32768 Len=4 TSval=1033615806 TSecr=2120443647 [TCP segment of a reassembled PDU]

Frame 24: 70 bytes on wire (560 bits), 70 bytes captured (560 bits) on interface en0, id 0
Ethernet II, Src: Tp-LinkT_55:94:64 (14:cc:20:55:94:64), Dst: Apple_d6:45:86 (a4:d1:8c:d6:45:86)
Internet Protocol Version 4, Src: 149.154.167.50, Dst: 192.168.0.103
Transmission Control Protocol, Src Port: 443, Dst Port: 51371, Seq: 956, Ack: 483, Len: 4

No.     Time           Source                Destination           Protocol Length Info
     25 5.480787       192.168.0.103         149.154.167.50        TCP      66     51371 → 443 [ACK] Seq=483 Ack=960 Win=2047 Len=0 TSval=2120443698 TSecr=1033615806

Frame 25: 66 bytes on wire (528 bits), 66 bytes captured (528 bits) on interface en0, id 0
Ethernet II, Src: Apple_d6:45:86 (a4:d1:8c:d6:45:86), Dst: Tp-LinkT_55:94:64 (14:cc:20:55:94:64)
Internet Protocol Version 4, Src: 192.168.0.103, Dst: 149.154.167.50
Transmission Control Protocol, Src Port: 51371, Dst Port: 443, Seq: 483, Ack: 960, Len: 0

No.     Time           Source                Destination           Protocol Length Info
     26 5.532436       149.154.167.50        192.168.0.103         SSL      878    Continuation Data

Frame 26: 878 bytes on wire (7024 bits), 878 bytes captured (7024 bits) on interface en0, id 0
Ethernet II, Src: Tp-LinkT_55:94:64 (14:cc:20:55:94:64), Dst: Apple_d6:45:86 (a4:d1:8c:d6:45:86)
Internet Protocol Version 4, Src: 149.154.167.50, Dst: 192.168.0.103
Transmission Control Protocol, Src Port: 443, Dst Port: 51371, Seq: 960, Ack: 483, Len: 812
[2 Reassembled TCP Segments (816 bytes): #24(4), #26(812)]
Transport Layer Security

No.     Time           Source                Destination           Protocol Length Info
     27 5.532553       192.168.0.103         149.154.167.50        TCP      66     51371 → 443 [ACK] Seq=483 Ack=1772 Win=2035 Len=0 TSval=2120443749 TSecr=1033615856

Frame 27: 66 bytes on wire (528 bits), 66 bytes captured (528 bits) on interface en0, id 0
Ethernet II, Src: Apple_d6:45:86 (a4:d1:8c:d6:45:86), Dst: Tp-LinkT_55:94:64 (14:cc:20:55:94:64)
Internet Protocol Version 4, Src: 192.168.0.103, Dst: 149.154.167.50
Transmission Control Protocol, Src Port: 51371, Dst Port: 443, Seq: 483, Ack: 1772, Len: 0

No.     Time           Source                Destination           Protocol Length Info
     28 5.535085       192.168.0.103         149.154.167.50        SSL      283    Continuation Data

Frame 28: 283 bytes on wire (2264 bits), 283 bytes captured (2264 bits) on interface en0, id 0
Ethernet II, Src: Apple_d6:45:86 (a4:d1:8c:d6:45:86), Dst: Tp-LinkT_55:94:64 (14:cc:20:55:94:64)
Internet Protocol Version 4, Src: 192.168.0.103, Dst: 149.154.167.50
Transmission Control Protocol, Src Port: 51371, Dst Port: 443, Seq: 483, Ack: 1772, Len: 217
Transport Layer Security

No.     Time           Source                Destination           Protocol Length Info
     29 5.587088       149.154.167.50        192.168.0.103         TCP      70     443 → 51371 [PSH, ACK] Seq=1772 Ack=700 Win=32768 Len=4 TSval=1033615912 TSecr=2120443751 [TCP segment of a reassembled PDU]

Frame 29: 70 bytes on wire (560 bits), 70 bytes captured (560 bits) on interface en0, id 0
Ethernet II, Src: Tp-LinkT_55:94:64 (14:cc:20:55:94:64), Dst: Apple_d6:45:86 (a4:d1:8c:d6:45:86)
Internet Protocol Version 4, Src: 149.154.167.50, Dst: 192.168.0.103
Transmission Control Protocol, Src Port: 443, Dst Port: 51371, Seq: 1772, Ack: 700, Len: 4

No.     Time           Source                Destination           Protocol Length Info
     30 5.587213       192.168.0.103         149.154.167.50        TCP      66     51371 → 443 [ACK] Seq=700 Ack=1776 Win=2047 Len=0 TSval=2120443802 TSecr=1033615912

Frame 30: 66 bytes on wire (528 bits), 66 bytes captured (528 bits) on interface en0, id 0
Ethernet II, Src: Apple_d6:45:86 (a4:d1:8c:d6:45:86), Dst: Tp-LinkT_55:94:64 (14:cc:20:55:94:64)
Internet Protocol Version 4, Src: 192.168.0.103, Dst: 149.154.167.50
Transmission Control Protocol, Src Port: 51371, Dst Port: 443, Seq: 700, Ack: 1776, Len: 0

No.     Time           Source                Destination           Protocol Length Info
     31 5.613094       149.154.167.50        192.168.0.103         SSL      734    Continuation Data

Frame 31: 734 bytes on wire (5872 bits), 734 bytes captured (5872 bits) on interface en0, id 0
Ethernet II, Src: Tp-LinkT_55:94:64 (14:cc:20:55:94:64), Dst: Apple_d6:45:86 (a4:d1:8c:d6:45:86)
Internet Protocol Version 4, Src: 149.154.167.50, Dst: 192.168.0.103
Transmission Control Protocol, Src Port: 443, Dst Port: 51371, Seq: 1776, Ack: 700, Len: 668
[2 Reassembled TCP Segments (672 bytes): #29(4), #31(668)]
Transport Layer Security

No.     Time           Source                Destination           Protocol Length Info
     32 5.613213       192.168.0.103         149.154.167.50        TCP      66     51371 → 443 [ACK] Seq=700 Ack=2444 Win=2037 Len=0 TSval=2120443828 TSecr=1033615938

Frame 32: 66 bytes on wire (528 bits), 66 bytes captured (528 bits) on interface en0, id 0
Ethernet II, Src: Apple_d6:45:86 (a4:d1:8c:d6:45:86), Dst: Tp-LinkT_55:94:64 (14:cc:20:55:94:64)
Internet Protocol Version 4, Src: 192.168.0.103, Dst: 149.154.167.50
Transmission Control Protocol, Src Port: 51371, Dst Port: 443, Seq: 700, Ack: 2444, Len: 0

No.     Time           Source                Destination           Protocol Length Info
     33 5.615260       192.168.0.103         149.154.167.50        SSL      251    Continuation Data

Frame 33: 251 bytes on wire (2008 bits), 251 bytes captured (2008 bits) on interface en0, id 0
Ethernet II, Src: Apple_d6:45:86 (a4:d1:8c:d6:45:86), Dst: Tp-LinkT_55:94:64 (14:cc:20:55:94:64)
Internet Protocol Version 4, Src: 192.168.0.103, Dst: 149.154.167.50
Transmission Control Protocol, Src Port: 51371, Dst Port: 443, Seq: 700, Ack: 2444, Len: 185
Transport Layer Security

No.     Time           Source                Destination           Protocol Length Info
     34 5.667313       149.154.167.50        192.168.0.103         TCP      70     443 → 51371 [PSH, ACK] Seq=2444 Ack=885 Win=32768 Len=4 TSval=1033615992 TSecr=2120443830 [TCP segment of a reassembled PDU]

Frame 34: 70 bytes on wire (560 bits), 70 bytes captured (560 bits) on interface en0, id 0
Ethernet II, Src: Tp-LinkT_55:94:64 (14:cc:20:55:94:64), Dst: Apple_d6:45:86 (a4:d1:8c:d6:45:86)
Internet Protocol Version 4, Src: 149.154.167.50, Dst: 192.168.0.103
Transmission Control Protocol, Src Port: 443, Dst Port: 51371, Seq: 2444, Ack: 885, Len: 4

No.     Time           Source                Destination           Protocol Length Info
     35 5.667437       192.168.0.103         149.154.167.50        TCP      66     51371 → 443 [ACK] Seq=885 Ack=2448 Win=2047 Len=0 TSval=2120443882 TSecr=1033615992

Frame 35: 66 bytes on wire (528 bits), 66 bytes captured (528 bits) on interface en0, id 0
Ethernet II, Src: Apple_d6:45:86 (a4:d1:8c:d6:45:86), Dst: Tp-LinkT_55:94:64 (14:cc:20:55:94:64)
Internet Protocol Version 4, Src: 192.168.0.103, Dst: 149.154.167.50
Transmission Control Protocol, Src Port: 51371, Dst Port: 443, Seq: 885, Ack: 2448, Len: 0

No.     Time           Source                Destination           Protocol Length Info
     36 5.685288       149.154.167.50        192.168.0.103         SSL      878    Continuation Data

Frame 36: 878 bytes on wire (7024 bits), 878 bytes captured (7024 bits) on interface en0, id 0
Ethernet II, Src: Tp-LinkT_55:94:64 (14:cc:20:55:94:64), Dst: Apple_d6:45:86 (a4:d1:8c:d6:45:86)
Internet Protocol Version 4, Src: 149.154.167.50, Dst: 192.168.0.103
Transmission Control Protocol, Src Port: 443, Dst Port: 51371, Seq: 2448, Ack: 885, Len: 812
[2 Reassembled TCP Segments (816 bytes): #34(4), #36(812)]
Transport Layer Security

No.     Time           Source                Destination           Protocol Length Info
     37 5.685438       192.168.0.103         149.154.167.50        TCP      66     51371 → 443 [ACK] Seq=885 Ack=3260 Win=2035 Len=0 TSval=2120443899 TSecr=1033616010

Frame 37: 66 bytes on wire (528 bits), 66 bytes captured (528 bits) on interface en0, id 0
Ethernet II, Src: Apple_d6:45:86 (a4:d1:8c:d6:45:86), Dst: Tp-LinkT_55:94:64 (14:cc:20:55:94:64)
Internet Protocol Version 4, Src: 192.168.0.103, Dst: 149.154.167.50
Transmission Control Protocol, Src Port: 51371, Dst Port: 443, Seq: 885, Ack: 3260, Len: 0

No.     Time           Source                Destination           Protocol Length Info
     38 5.689166       192.168.0.103         149.154.167.50        SSL      235    Continuation Data

Frame 38: 235 bytes on wire (1880 bits), 235 bytes captured (1880 bits) on interface en0, id 0
Ethernet II, Src: Apple_d6:45:86 (a4:d1:8c:d6:45:86), Dst: Tp-LinkT_55:94:64 (14:cc:20:55:94:64)
Internet Protocol Version 4, Src: 192.168.0.103, Dst: 149.154.167.50
Transmission Control Protocol, Src Port: 51371, Dst Port: 443, Seq: 885, Ack: 3260, Len: 169
Transport Layer Security

No.     Time           Source                Destination           Protocol Length Info
     39 5.740787       149.154.167.50        192.168.0.103         TCP      70     443 → 51371 [PSH, ACK] Seq=3260 Ack=1054 Win=32768 Len=4 TSval=1033616066 TSecr=2120443902 [TCP segment of a reassembled PDU]

Frame 39: 70 bytes on wire (560 bits), 70 bytes captured (560 bits) on interface en0, id 0
Ethernet II, Src: Tp-LinkT_55:94:64 (14:cc:20:55:94:64), Dst: Apple_d6:45:86 (a4:d1:8c:d6:45:86)
Internet Protocol Version 4, Src: 149.154.167.50, Dst: 192.168.0.103
Transmission Control Protocol, Src Port: 443, Dst Port: 51371, Seq: 3260, Ack: 1054, Len: 4

No.     Time           Source                Destination           Protocol Length Info
     40 5.740872       192.168.0.103         149.154.167.50        TCP      66     51371 → 443 [ACK] Seq=1054 Ack=3264 Win=2047 Len=0 TSval=2120443953 TSecr=1033616066

Frame 40: 66 bytes on wire (528 bits), 66 bytes captured (528 bits) on interface en0, id 0
Ethernet II, Src: Apple_d6:45:86 (a4:d1:8c:d6:45:86), Dst: Tp-LinkT_55:94:64 (14:cc:20:55:94:64)
Internet Protocol Version 4, Src: 192.168.0.103, Dst: 149.154.167.50
Transmission Control Protocol, Src Port: 51371, Dst Port: 443, Seq: 1054, Ack: 3264, Len: 0

No.     Time           Source                Destination           Protocol Length Info
     41 5.756474       149.154.167.50        192.168.0.103         SSL      734    Continuation Data

Frame 41: 734 bytes on wire (5872 bits), 734 bytes captured (5872 bits) on interface en0, id 0
Ethernet II, Src: Tp-LinkT_55:94:64 (14:cc:20:55:94:64), Dst: Apple_d6:45:86 (a4:d1:8c:d6:45:86)
Internet Protocol Version 4, Src: 149.154.167.50, Dst: 192.168.0.103
Transmission Control Protocol, Src Port: 443, Dst Port: 51371, Seq: 3264, Ack: 1054, Len: 668
[2 Reassembled TCP Segments (672 bytes): #39(4), #41(668)]
Transport Layer Security

No.     Time           Source                Destination           Protocol Length Info
     42 5.756593       192.168.0.103         149.154.167.50        TCP      66     51371 → 443 [ACK] Seq=1054 Ack=3932 Win=2037 Len=0 TSval=2120443968 TSecr=1033616080

Frame 42: 66 bytes on wire (528 bits), 66 bytes captured (528 bits) on interface en0, id 0
Ethernet II, Src: Apple_d6:45:86 (a4:d1:8c:d6:45:86), Dst: Tp-LinkT_55:94:64 (14:cc:20:55:94:64)
Internet Protocol Version 4, Src: 192.168.0.103, Dst: 149.154.167.50
Transmission Control Protocol, Src Port: 51371, Dst Port: 443, Seq: 1054, Ack: 3932, Len: 0

No.     Time           Source                Destination           Protocol Length Info
     43 5.758685       192.168.0.103         149.154.167.50        SSL      267    Continuation Data

Frame 43: 267 bytes on wire (2136 bits), 267 bytes captured (2136 bits) on interface en0, id 0
Ethernet II, Src: Apple_d6:45:86 (a4:d1:8c:d6:45:86), Dst: Tp-LinkT_55:94:64 (14:cc:20:55:94:64)
Internet Protocol Version 4, Src: 192.168.0.103, Dst: 149.154.167.50
Transmission Control Protocol, Src Port: 51371, Dst Port: 443, Seq: 1054, Ack: 3932, Len: 201
Transport Layer Security

No.     Time           Source                Destination           Protocol Length Info
     44 5.810820       149.154.167.50        192.168.0.103         TCP      70     443 → 51371 [PSH, ACK] Seq=3932 Ack=1255 Win=32768 Len=4 TSval=1033616136 TSecr=2120443970 [TCP segment of a reassembled PDU]

Frame 44: 70 bytes on wire (560 bits), 70 bytes captured (560 bits) on interface en0, id 0
Ethernet II, Src: Tp-LinkT_55:94:64 (14:cc:20:55:94:64), Dst: Apple_d6:45:86 (a4:d1:8c:d6:45:86)
Internet Protocol Version 4, Src: 149.154.167.50, Dst: 192.168.0.103
Transmission Control Protocol, Src Port: 443, Dst Port: 51371, Seq: 3932, Ack: 1255, Len: 4

No.     Time           Source                Destination           Protocol Length Info
     45 5.811222       192.168.0.103         149.154.167.50        TCP      66     51371 → 443 [ACK] Seq=1255 Ack=3936 Win=2047 Len=0 TSval=2120444021 TSecr=1033616136

Frame 45: 66 bytes on wire (528 bits), 66 bytes captured (528 bits) on interface en0, id 0
Ethernet II, Src: Apple_d6:45:86 (a4:d1:8c:d6:45:86), Dst: Tp-LinkT_55:94:64 (14:cc:20:55:94:64)
Internet Protocol Version 4, Src: 192.168.0.103, Dst: 149.154.167.50
Transmission Control Protocol, Src Port: 51371, Dst Port: 443, Seq: 1255, Ack: 3936, Len: 0

No.     Time           Source                Destination           Protocol Length Info
     46 5.875565       149.154.167.50        192.168.0.103         SSL      878    Continuation Data

Frame 46: 878 bytes on wire (7024 bits), 878 bytes captured (7024 bits) on interface en0, id 0
Ethernet II, Src: Tp-LinkT_55:94:64 (14:cc:20:55:94:64), Dst: Apple_d6:45:86 (a4:d1:8c:d6:45:86)
Internet Protocol Version 4, Src: 149.154.167.50, Dst: 192.168.0.103
Transmission Control Protocol, Src Port: 443, Dst Port: 51371, Seq: 3936, Ack: 1255, Len: 812
[2 Reassembled TCP Segments (816 bytes): #44(4), #46(812)]
Transport Layer Security

No.     Time           Source                Destination           Protocol Length Info
     47 5.875684       192.168.0.103         149.154.167.50        TCP      66     51371 → 443 [ACK] Seq=1255 Ack=4748 Win=2035 Len=0 TSval=2120444085 TSecr=1033616194

Frame 47: 66 bytes on wire (528 bits), 66 bytes captured (528 bits) on interface en0, id 0
Ethernet II, Src: Apple_d6:45:86 (a4:d1:8c:d6:45:86), Dst: Tp-LinkT_55:94:64 (14:cc:20:55:94:64)
Internet Protocol Version 4, Src: 192.168.0.103, Dst: 149.154.167.50
Transmission Control Protocol, Src Port: 51371, Dst Port: 443, Seq: 1255, Ack: 4748, Len: 0

No.     Time           Source                Destination           Protocol Length Info
     48 5.878234       192.168.0.103         149.154.167.50        SSL      267    Continuation Data

Frame 48: 267 bytes on wire (2136 bits), 267 bytes captured (2136 bits) on interface en0, id 0
Ethernet II, Src: Apple_d6:45:86 (a4:d1:8c:d6:45:86), Dst: Tp-LinkT_55:94:64 (14:cc:20:55:94:64)
Internet Protocol Version 4, Src: 192.168.0.103, Dst: 149.154.167.50
Transmission Control Protocol, Src Port: 51371, Dst Port: 443, Seq: 1255, Ack: 4748, Len: 201
Transport Layer Security

No.     Time           Source                Destination           Protocol Length Info
     49 5.930356       149.154.167.50        192.168.0.103         TCP      70     443 → 51371 [PSH, ACK] Seq=4748 Ack=1456 Win=32768 Len=4 TSval=1033616255 TSecr=2120444087 [TCP segment of a reassembled PDU]

Frame 49: 70 bytes on wire (560 bits), 70 bytes captured (560 bits) on interface en0, id 0
Ethernet II, Src: Tp-LinkT_55:94:64 (14:cc:20:55:94:64), Dst: Apple_d6:45:86 (a4:d1:8c:d6:45:86)
Internet Protocol Version 4, Src: 149.154.167.50, Dst: 192.168.0.103
Transmission Control Protocol, Src Port: 443, Dst Port: 51371, Seq: 4748, Ack: 1456, Len: 4

No.     Time           Source                Destination           Protocol Length Info
     50 5.930480       192.168.0.103         149.154.167.50        TCP      66     51371 → 443 [ACK] Seq=1456 Ack=4752 Win=2047 Len=0 TSval=2120444139 TSecr=1033616255

Frame 50: 66 bytes on wire (528 bits), 66 bytes captured (528 bits) on interface en0, id 0
Ethernet II, Src: Apple_d6:45:86 (a4:d1:8c:d6:45:86), Dst: Tp-LinkT_55:94:64 (14:cc:20:55:94:64)
Internet Protocol Version 4, Src: 192.168.0.103, Dst: 149.154.167.50
Transmission Control Protocol, Src Port: 51371, Dst Port: 443, Seq: 1456, Ack: 4752, Len: 0

No.     Time           Source                Destination           Protocol Length Info
     51 5.988948       149.154.167.50        192.168.0.103         SSL      734    Continuation Data

Frame 51: 734 bytes on wire (5872 bits), 734 bytes captured (5872 bits) on interface en0, id 0
Ethernet II, Src: Tp-LinkT_55:94:64 (14:cc:20:55:94:64), Dst: Apple_d6:45:86 (a4:d1:8c:d6:45:86)
Internet Protocol Version 4, Src: 149.154.167.50, Dst: 192.168.0.103
Transmission Control Protocol, Src Port: 443, Dst Port: 51371, Seq: 4752, Ack: 1456, Len: 668
[2 Reassembled TCP Segments (672 bytes): #49(4), #51(668)]
Transport Layer Security

No.     Time           Source                Destination           Protocol Length Info
     52 5.989077       192.168.0.103         149.154.167.50        TCP      66     51371 → 443 [ACK] Seq=1456 Ack=5420 Win=2037 Len=0 TSval=2120444197 TSecr=1033616311

Frame 52: 66 bytes on wire (528 bits), 66 bytes captured (528 bits) on interface en0, id 0
Ethernet II, Src: Apple_d6:45:86 (a4:d1:8c:d6:45:86), Dst: Tp-LinkT_55:94:64 (14:cc:20:55:94:64)
Internet Protocol Version 4, Src: 192.168.0.103, Dst: 149.154.167.50
Transmission Control Protocol, Src Port: 51371, Dst Port: 443, Seq: 1456, Ack: 5420, Len: 0

No.     Time           Source                Destination           Protocol Length Info
     53 5.991084       192.168.0.103         149.154.167.50        SSL      267    Continuation Data

Frame 53: 267 bytes on wire (2136 bits), 267 bytes captured (2136 bits) on interface en0, id 0
Ethernet II, Src: Apple_d6:45:86 (a4:d1:8c:d6:45:86), Dst: Tp-LinkT_55:94:64 (14:cc:20:55:94:64)
Internet Protocol Version 4, Src: 192.168.0.103, Dst: 149.154.167.50
Transmission Control Protocol, Src Port: 51371, Dst Port: 443, Seq: 1456, Ack: 5420, Len: 201
Transport Layer Security

No.     Time           Source                Destination           Protocol Length Info
     54 6.043231       149.154.167.50        192.168.0.103         TCP      70     443 → 51371 [PSH, ACK] Seq=5420 Ack=1657 Win=32768 Len=4 TSval=1033616368 TSecr=2120444199 [TCP segment of a reassembled PDU]

Frame 54: 70 bytes on wire (560 bits), 70 bytes captured (560 bits) on interface en0, id 0
Ethernet II, Src: Tp-LinkT_55:94:64 (14:cc:20:55:94:64), Dst: Apple_d6:45:86 (a4:d1:8c:d6:45:86)
Internet Protocol Version 4, Src: 149.154.167.50, Dst: 192.168.0.103
Transmission Control Protocol, Src Port: 443, Dst Port: 51371, Seq: 5420, Ack: 1657, Len: 4

No.     Time           Source                Destination           Protocol Length Info
     55 6.043354       192.168.0.103         149.154.167.50        TCP      66     51371 → 443 [ACK] Seq=1657 Ack=5424 Win=2047 Len=0 TSval=2120444250 TSecr=1033616368

Frame 55: 66 bytes on wire (528 bits), 66 bytes captured (528 bits) on interface en0, id 0
Ethernet II, Src: Apple_d6:45:86 (a4:d1:8c:d6:45:86), Dst: Tp-LinkT_55:94:64 (14:cc:20:55:94:64)
Internet Protocol Version 4, Src: 192.168.0.103, Dst: 149.154.167.50
Transmission Control Protocol, Src Port: 51371, Dst Port: 443, Seq: 1657, Ack: 5424, Len: 0

No.     Time           Source                Destination           Protocol Length Info
     56 6.079250       35.190.243.59         192.168.0.103         TCP      77     4070 → 51320 [PSH, ACK] Seq=1 Ack=1 Win=16 Len=11 TSval=2058744235 TSecr=2120421065

Frame 56: 77 bytes on wire (616 bits), 77 bytes captured (616 bits) on interface en0, id 0
Ethernet II, Src: Tp-LinkT_55:94:64 (14:cc:20:55:94:64), Dst: Apple_d6:45:86 (a4:d1:8c:d6:45:86)
Internet Protocol Version 4, Src: 35.190.243.59, Dst: 192.168.0.103
Transmission Control Protocol, Src Port: 4070, Dst Port: 51320, Seq: 1, Ack: 1, Len: 11
Data (11 bytes)

0000  66 8a c2 10 4d 72 c5 5e 6e 36 61                  f...Mr.^n6a

No.     Time           Source                Destination           Protocol Length Info
     57 6.079386       192.168.0.103         35.190.243.59         TCP      66     51320 → 4070 [ACK] Seq=1 Ack=12 Win=2047 Len=0 TSval=2120444286 TSecr=2058744235

Frame 57: 66 bytes on wire (528 bits), 66 bytes captured (528 bits) on interface en0, id 0
Ethernet II, Src: Apple_d6:45:86 (a4:d1:8c:d6:45:86), Dst: Tp-LinkT_55:94:64 (14:cc:20:55:94:64)
Internet Protocol Version 4, Src: 192.168.0.103, Dst: 35.190.243.59
Transmission Control Protocol, Src Port: 51320, Dst Port: 4070, Seq: 1, Ack: 12, Len: 0

No.     Time           Source                Destination           Protocol Length Info
     58 6.088214       149.154.167.50        192.168.0.103         SSL      878    Continuation Data

Frame 58: 878 bytes on wire (7024 bits), 878 bytes captured (7024 bits) on interface en0, id 0
Ethernet II, Src: Tp-LinkT_55:94:64 (14:cc:20:55:94:64), Dst: Apple_d6:45:86 (a4:d1:8c:d6:45:86)
Internet Protocol Version 4, Src: 149.154.167.50, Dst: 192.168.0.103
Transmission Control Protocol, Src Port: 443, Dst Port: 51371, Seq: 5424, Ack: 1657, Len: 812
[2 Reassembled TCP Segments (816 bytes): #54(4), #58(812)]
Transport Layer Security

No.     Time           Source                Destination           Protocol Length Info
     59 6.088348       192.168.0.103         149.154.167.50        TCP      66     51371 → 443 [ACK] Seq=1657 Ack=6236 Win=2035 Len=0 TSval=2120444294 TSecr=1033616413

Frame 59: 66 bytes on wire (528 bits), 66 bytes captured (528 bits) on interface en0, id 0
Ethernet II, Src: Apple_d6:45:86 (a4:d1:8c:d6:45:86), Dst: Tp-LinkT_55:94:64 (14:cc:20:55:94:64)
Internet Protocol Version 4, Src: 192.168.0.103, Dst: 149.154.167.50
Transmission Control Protocol, Src Port: 51371, Dst Port: 443, Seq: 1657, Ack: 6236, Len: 0

No.     Time           Source                Destination           Protocol Length Info
     60 6.090840       192.168.0.103         149.154.167.50        SSL      283    Continuation Data

Frame 60: 283 bytes on wire (2264 bits), 283 bytes captured (2264 bits) on interface en0, id 0
Ethernet II, Src: Apple_d6:45:86 (a4:d1:8c:d6:45:86), Dst: Tp-LinkT_55:94:64 (14:cc:20:55:94:64)
Internet Protocol Version 4, Src: 192.168.0.103, Dst: 149.154.167.50
Transmission Control Protocol, Src Port: 51371, Dst Port: 443, Seq: 1657, Ack: 6236, Len: 217
Transport Layer Security

No.     Time           Source                Destination           Protocol Length Info
     61 6.164263       149.154.167.50        192.168.0.103         TCP      70     443 → 51371 [PSH, ACK] Seq=6236 Ack=1874 Win=32768 Len=4 TSval=1033616471 TSecr=2120444296 [TCP segment of a reassembled PDU]

Frame 61: 70 bytes on wire (560 bits), 70 bytes captured (560 bits) on interface en0, id 0
Ethernet II, Src: Tp-LinkT_55:94:64 (14:cc:20:55:94:64), Dst: Apple_d6:45:86 (a4:d1:8c:d6:45:86)
Internet Protocol Version 4, Src: 149.154.167.50, Dst: 192.168.0.103
Transmission Control Protocol, Src Port: 443, Dst Port: 51371, Seq: 6236, Ack: 1874, Len: 4

No.     Time           Source                Destination           Protocol Length Info
     62 6.164270       149.154.167.50        192.168.0.103         SSL      734    Continuation Data

Frame 62: 734 bytes on wire (5872 bits), 734 bytes captured (5872 bits) on interface en0, id 0
Ethernet II, Src: Tp-LinkT_55:94:64 (14:cc:20:55:94:64), Dst: Apple_d6:45:86 (a4:d1:8c:d6:45:86)
Internet Protocol Version 4, Src: 149.154.167.50, Dst: 192.168.0.103
Transmission Control Protocol, Src Port: 443, Dst Port: 51371, Seq: 6240, Ack: 1874, Len: 668
[2 Reassembled TCP Segments (672 bytes): #61(4), #62(668)]
Transport Layer Security

No.     Time           Source                Destination           Protocol Length Info
     63 6.164432       192.168.0.103         149.154.167.50        TCP      66     51371 → 443 [ACK] Seq=1874 Ack=6240 Win=2047 Len=0 TSval=2120444368 TSecr=1033616471

Frame 63: 66 bytes on wire (528 bits), 66 bytes captured (528 bits) on interface en0, id 0
Ethernet II, Src: Apple_d6:45:86 (a4:d1:8c:d6:45:86), Dst: Tp-LinkT_55:94:64 (14:cc:20:55:94:64)
Internet Protocol Version 4, Src: 192.168.0.103, Dst: 149.154.167.50
Transmission Control Protocol, Src Port: 51371, Dst Port: 443, Seq: 1874, Ack: 6240, Len: 0

No.     Time           Source                Destination           Protocol Length Info
     64 6.164433       192.168.0.103         149.154.167.50        TCP      66     51371 → 443 [ACK] Seq=1874 Ack=6908 Win=2037 Len=0 TSval=2120444368 TSecr=1033616487

Frame 64: 66 bytes on wire (528 bits), 66 bytes captured (528 bits) on interface en0, id 0
Ethernet II, Src: Apple_d6:45:86 (a4:d1:8c:d6:45:86), Dst: Tp-LinkT_55:94:64 (14:cc:20:55:94:64)
Internet Protocol Version 4, Src: 192.168.0.103, Dst: 149.154.167.50
Transmission Control Protocol, Src Port: 51371, Dst Port: 443, Seq: 1874, Ack: 6908, Len: 0

No.     Time           Source                Destination           Protocol Length Info
     65 6.166610       192.168.0.103         149.154.167.50        SSL      251    Continuation Data

Frame 65: 251 bytes on wire (2008 bits), 251 bytes captured (2008 bits) on interface en0, id 0
Ethernet II, Src: Apple_d6:45:86 (a4:d1:8c:d6:45:86), Dst: Tp-LinkT_55:94:64 (14:cc:20:55:94:64)
Internet Protocol Version 4, Src: 192.168.0.103, Dst: 149.154.167.50
Transmission Control Protocol, Src Port: 51371, Dst Port: 443, Seq: 1874, Ack: 6908, Len: 185
Transport Layer Security

No.     Time           Source                Destination           Protocol Length Info
     66 6.246297       149.154.167.50        192.168.0.103         TCP      70     443 → 51371 [PSH, ACK] Seq=6908 Ack=2059 Win=32768 Len=4 TSval=1033616544 TSecr=2120444370 [TCP segment of a reassembled PDU]

Frame 66: 70 bytes on wire (560 bits), 70 bytes captured (560 bits) on interface en0, id 0
Ethernet II, Src: Tp-LinkT_55:94:64 (14:cc:20:55:94:64), Dst: Apple_d6:45:86 (a4:d1:8c:d6:45:86)
Internet Protocol Version 4, Src: 149.154.167.50, Dst: 192.168.0.103
Transmission Control Protocol, Src Port: 443, Dst Port: 51371, Seq: 6908, Ack: 2059, Len: 4

No.     Time           Source                Destination           Protocol Length Info
     67 6.246385       192.168.0.103         149.154.167.50        TCP      66     51371 → 443 [ACK] Seq=2059 Ack=6912 Win=2047 Len=0 TSval=2120444449 TSecr=1033616544

