{\rtf1\ansi\ansicpg1252{\fonttbl{\f0\froman\fcharset0 Times New Roman;}{\f1\froman\fcharset0 Times New Roman;}{\f2\froman\fcharset0 Times New Roman;}{\f3\fswiss\fcharset0 Arial;}}{\colortbl ;\red0 \green0 \blue9;}{\stylesheet{\fs22\f0\sqformat\spriority1 Normal}{\s1\li102\f0\fs28\sbasedon0\sqformat\spriority1 Body Text}{\s2\li2539\ri1834\qc\outlinelevel0\f0\fs32\sbasedon0\sqformat\spriority1 Heading 1}{\s3\li102\outlinelevel1\f1\fs28\b1\sbasedon0\sqformat\spriority1 Heading 2}{\s4\li102\fi359\ri142\sb1\f0\sbasedon0\sqformat\spriority1 List Paragraph}{\s5\sbasedon0\sqformat\spriority1 Table Paragraph}}{\*\listtable{\list\listtemplateid2181{\listlevel\levelnfc0\levelstartat1\leveljc0\li102\fi-348{\leveltext\'02\'00.;}{\levelnumbers\'01;}\f0\fs28\b0\expnd0\expndtw0\charscalex100}{\listlevel\levelnfc23\leveljc0\li1046\fi-348{\leveltext\'01\'95;}{\levelnumbers;}}{\listlevel\levelnfc23\leveljc0\li1993\fi-348{\leveltext\'01\'95;}{\levelnumbers;}}{\listlevel\levelnfc23\leveljc0\li2939\fi-348{\leveltext\'01\'95;}{\levelnumbers;}}{\listlevel\levelnfc23\leveljc0\li3886\fi-348{\leveltext\'01\'95;}{\levelnumbers;}}{\listlevel\levelnfc23\leveljc0\li4833\fi-348{\leveltext\'01\'95;}{\levelnumbers;}}{\listlevel\levelnfc23\leveljc0\li5779\fi-348{\leveltext\'01\'95;}{\levelnumbers;}}{\listlevel\levelnfc23\leveljc0\li6726\fi-348{\leveltext\'01\'95;}{\levelnumbers;}}{\listlevel\levelnfc23\leveljc0\li7673\fi-348{\leveltext\'01\'95;}{\levelnumbers;}}\listid1026}}{\*\listoverridetable{\listoverride\listoverridecount0\listid1026\ls1}}{\info{\author \uc1\u1055 ?\uc1\u1086 ?\uc1\u1083 ?\uc1\u1100 ?\uc1\u1079 ?\uc1\u1086 ?\uc1\u1074 ?\uc1\u1072 ?\uc1\u1090 ?\uc1\u1077 ?\uc1\u1083 ?\uc1\u1100 ? Windows}{\creatim\yr2020\mo5\dy2\hr10\min54\sec53}{\revtim\yr2020\mo3\dy23\hr12\min45\sec53}}{\*\userprops {\propname Creator}\proptype30{\staticval Microsoft\'AE Word 2016}}\jexpand\dntblnsbdb\viewkind1\noxlattoyen\nospaceforul\useltbaln\paperw11910\paperh16840\margl1600\margr740\margt1360\margb280\noindnmbrts\sectd\sbknone\pard\plain\s1\nooverflow\nocwrap\lnbrkrule\li1870\sl240\slmult1\f0\fs20{\*\shppict{\pict
{\*\picprop\shplid23{\sp{\sn shapeType}{\sv 75}}{\sp{\sn fFlipH}{\sv 0}}{\sp{\sn fFlipV}{\sv 0}}{\sp{\sn pibFlags}{\sv 2}}{\sp{\sn fLine}{\sv 0}}
}\picscalex109\picscaley101\piccropl0\piccropr0\piccropt0\piccropb0\picw9736\pich2328\picwgoal5520\pichgoal1320
\jpegblip{\*\blipuid 6f9df2fe9a0e3e42bca4d2ff1863768f}
ffd8ffe000104a46494600010101006000600000ffdb00430003020203020203
03030304030304050805050404050a070706080c0a0c0c0b0a0b0b0d0e12100d
0e110e0b0b1016101113141515150c0f171816141812141514ffdb0043010304
0405040509050509140d0b0d1414141414141414141414141414141414141414
141414141414141414141414141414141414141414141414141414141414ffc0
0011080058017003012200021101031101ffc4001f0000010501010101010100
000000000000000102030405060708090a0bffc400b510000201030302040305
0504040000017d01020300041105122131410613516107227114328191a10823
42b1c11552d1f02433627282090a161718191a25262728292a3435363738393a
434445464748494a535455565758595a636465666768696a737475767778797a
838485868788898a92939495969798999aa2a3a4a5a6a7a8a9aab2b3b4b5b6b7
b8b9bac2c3c4c5c6c7c8c9cad2d3d4d5d6d7d8d9dae1e2e3e4e5e6e7e8e9eaf1
f2f3f4f5f6f7f8f9faffc4001f01000301010101010101010100000000000001
02030405060708090a0bffc400b5110002010204040304070504040001027700
0102031104052131061241510761711322328108144291a1b1c109233352f015
6272d10a162434e125f11718191a262728292a35363738393a43444546474849
4a535455565758595a636465666768696a737475767778797a82838485868788
898a92939495969798999aa2a3a4a5a6a7a8a9aab2b3b4b5b6b7b8b9bac2c3c4
c5c6c7c8c9cad2d3d4d5d6d7d8d9dae2e3e4e5e6e7e8e9eaf2f3f4f5f6f7f8f9
faffda000c03010002110311003f00fd53af0bf8c3a87c51b0f8b1f0ca2f0cde
78762f06deeac96fa8477a9706fa4c5bdc49260a7eefcbf2e3e33ff2d3cbaf74
af00fda1fe2bd87c3ef88ff05b4cb9d0b58d5a4d5fc47208e7d36d3cc8ed0fd9
a4b712498e9fbcbd8ff0f32803dfe8a28a0028a28a0028a28a0028a28a0028a2
8a0028a28a0028a28a0028a28a0028a28a0028a28a0028a28a0028a28a0028a2
8a0028a28a0028a28a0028a28a0028a28a0028a28a0028a28a0028a28a002b83
f8d9a8eb9a3fc23f175f78704075eb7d2ee24b31712796a2411923e7edf5aef2
bca7f699f1ada7c3ef809e38d66f2d2eef625d364b74b6d3edfcf9649271e547
88fbfef241401daf82db5eb8f0eda49e2986c6df5968ff00d222d3a491edc7d3
7f35d0d737e0dd7e0f15f85346d62182eada0d42ce1b98edef63f2ee230f1ef0
248ff81f9e7deba4a002be0afdab7e3378e7c15f1a24d3ad3c41e04b0b2b4b7b
797448b56b3bb92e23924b8b377fb47952631e64431ed20afb47c75aa4fa0783
f5ed4ed6e6deca7b4b0b8b88ee6f0e228e448cec2ffec67935f967e19fdab7c6
5e23f0beaf3c7a77879af6fad22b07bdbf6b8b67b7937f9925e7facdfbe4b896
3937c7ff003ce3fe08a803f51fe1fea5a96b9e08d02fb597b39b54bbb0b7b8bb
7d3b79b6791e305fcbdfcf97e95d4d7c7dff0004fef8e9adfc67d1bc6f2ea82c
6caced2f6d85a6916b6d25bc96e248f32c9e5bff00cb391f320f73257d834005
145140051451400514514005145140051451400556b9bb8ecede49a7711c51a6
f77f4ab358be24ba96d3c39aa4f1a4523a5a48e91dc3f9719c27477edf5a00e4
3e06f88f51f1378021bad6755835cd53ed1279b7b656725bdbca923f99118d24
e76795247cd7a4d791fc134d26c34ebdd37468fcb8aded6c6454822f2a0c7d9f
ecfbe34d9ff4eefddfa57ae50014514500145452ca90c6ceedb117a9acfd075e
d33c51a45bea5a55dc57da7dc0fddcb17dc7a00e0fc29fb447c3ff00164baac7
6de29d22dce9f72f6f27dab50b71e601ff002d13f79f72ac783fe35f843c77e3
2d5fc33a26ab6b7fa8e99187736f7504aae38cecd8e4fc9bc03c0afc92f8c3f0
b3c08ff167e20da787b4116571a7dc7991dadbea1676f14927da6e2393cb8e48
e48ffe79feeffe59f97feaff00e5a47f4fff00c1317c0be07d0bc49e32bcd134
a51af5b1b8b57d4d6e12e316e6e311c698fb83e4ff009e71efebfbcc64007e8b
d158efe23d313c409a1b5fc09aac901b88ecb3fbcf2c1c6fad8a0028a28a002b
8cd5f56d463f883a1d9dbdfc10e9b25bcff6bb2920fde4f263f7451fb7dc92bb
3af29d275ab1d4fe29ea043b4b7304f1d94725ca9d994b67924fb3feec7fcf43
fc6fff002d3a5007ab5145140051451400514514005145140051451400514514
0057cf3fb58f8ffc49e08b0f0a47a44fe16b5d16ff00538e3d525f11dccb6efe
5c7247227d9cc7d4e457d0d5f0a78f3e376baffb406b1a25cc3e1bbc9343d604
96e6fa591112dfcb1f668c93c9ff004893cc93cbe7cc8e3ff9671d007be7ec99
e29f1478abe13c5278affe11d9a4b49fec760fe1bb992e207b68e38fcb2ef27f
cb4e7f957b7d7c33fb347c76d67c41f1d34ef08407c336ba74f6779733c1a6dc
4926eb7ff596e91ffd348bfd5ffd73ff00ae71d7dcd401e1bfb6569561aa7ecd
9e363aa9b316b6966978d25fdb99604f2a54937bc7ff002d00d9f73bd7877ecc
df0dff00b7741f1a2d9f843c21e29b6b0f105c69d05d6b5713dbdc43e5dbdbff
00a3c919b2ff00967d3f82bb7fdae7c4d71e23b4baf876d2ea575e1df12585c6
93767c2da7a6a17a979c486390799fbafdc7ef3fd59e03f35e61f00fe246bbe1
4f07ea57fa6c5e3896e7c49aa5c6b97f18f04a3c71ea127fc7cc71ff00a47fab
f32334019bfb0668fa3defc639355596cee7c411785e57792dadee13ece7fb43
ecf2471c925bc5e647fe8fe5f57fde452c9ff2d2bf436bf33be02dddff00c31f
8812dc786078d2e6fee2effe111d323d6bc2f1c56f71bef24bcb8f324127eefc
bb8b8bdffb671ffd33afd31a0028a28a0028a28a0028a28a002bf216ebc45e32
f027c63f892f278cbc616d73aa6a1f69b3d3740d63ecf2491c9717127ef3fd0a
4ff57e67fe44afd7aafc6cf897f00bc65f11be2aeada97c3eb5d26d468f2799a
a5cdedfc7676f1c9717127ef3ccf33fd67eeff00f21d007b0fec8a7c51e25fda
bf4af16378b75dd73459eda4b7b8875ad43ed172924965e679527fa3c7feafcb
8ebf4cabf1374dfd9dbc61a3f872e7c23e28d16c74df1ccfaedbff0064797279
f1f99791feee2f36393fd5c9fbbe7ccfddd6db7ec8df10de2b8b1bd4f0b9d7f5
411ff607f64ea725c5949e5ffc7c7da2e3ed31f97e5c7ff4ce4a00fd97af35f8
fef771fc18f191b1925b6bd1a5c9e5c914b1c4e871ff003d24f913f1afcb3b1f
d933c756b677561a945e1c3ab6af1c71f86a4d2758b8bfb692e23963fb409e4f
b47eef893ad45e09fd96fc77a77c48f04daf8b2d34bbad135cbef2e3bef046b9
24d736f24119b893cb93ed1fbb3fbbff00ae63fd676a00fd58f0d694da17c46b
ed36d2ddedf464d034e8edadbadbdaf9725c27971fa7c9fcab8df8cffb52f87f
e02ebbf62f1369da9c1666d3ed8baa08bfd19f93bd3ccf5418cffd748ebe55fd
b3b4dd7be385afc3a8e1d334ef0f78d92e2e6ce3b6bcd4248e38a393cbf2e3bc
ff0057247e61b790c727ef23fddffd34af9e6f3f67ff00883e08f09f89ad7c47
6fa2cb6de24b3fb1e8ff00d83a9ff6847249e6797247e6799feb3f791d007dc5
61ff00053bf849a95f476761732dedc49c47142fbe47afa4be1878dedfe23782
b4ef11dae977ba5db5ff009924506a1108a4d9e61c498ff6c61ff1afc6bf0efe
c8ff00157e1378cbc3fe26f13787747b3d1f4cbc8ecef6e74ed4e3b892ce4c3c
71f991f9bfbbe767e9f84963fb3afc40f196857be32d20e907c1ef36a173f69b
9d4a44d44c105c49f6c922b4fb48f33618e5ff009e7bfcb1f72803f677e2069f
1eabe06f10da4dbfcb9b4fb84728fb0f319ef5f8bd07883c4fe14f133787fc2f
178a3c49e15b6d524b6bbd552df58f3608fcb8e4fdd471ea11f9927ef3fd598e
3ff967ff003d2935ff00d96fe28e8de06d53c4b7116813784e0d33fb6649c6ab
27f6b7f67795e67da3ec9f6cff009e7ff2cfccab1e14f807e28f88d77e25bbf8
209a26a5e08bbbefeca87fb7b52f22e2e658e38e4922b7324be63f12472799f2
7fe39401e6de26b0b2bfd47ccd01fc2ff10b4db88e3924b9f13eab71652c573f
bcfddc76f25e4727fe8cff00595d47846ea4f0c787a7bef0fdfc97de3fb88ae2
4ff843bc3926a13d9451c7247fbdfb45bde47e5c7b3fe9a49fbcaf36f1b6bde1
7d1bc39e1db8f0ce75bb8fecfb78f50b1b98ef238e093fe5a0f323b88ffe9947
e5fef3feba57a4fc36f04cdf135fc2b17c35bad36e3c77a7d9de6a5ac47af3c9
6f67671c725bff00ac92e24ff96727fd74ff00b67401f4cfec086ffc63f1f9f5
3f11cfafd8ebfa559c58d16f7fb4228a2924b393cc94fda2e67f307ef3e419e9
2799e5c75fa8d5f84eff0004f5b87c733f826e0588f8d77daa5bf91656f7720d
3e4b77b4b89fcd0e971e598fcbf2e4f33fe59fdcf2f15d7df7ecc7f1685ee99a
64cbe174d675833db68a9a4eb13dcd95e7911f9971be7fb6ff00a3f971fef3fd
5f3401fa71f1c7f6a1f0efc01d56ded7c4761a91b6b8b5fb67f6847166dc47e6
1127ef3b79631c7fd348fd6bce34bff8297fc20d5e7b7b4b4be9ee6e6e3fd45b
443cc924af80affe1578c7c050f8abc35aba58dfebbadf87c7d82cb46bf92f2d
a4325c7d9e3ff48924ff0059e64727eeff0077e5d6d783ff0065bf8a9f0bfc49
e1cd77c55e16d0b4ed1b48bc8e3bfb8d3b53fb6491dc492491c6648fcdfddffc
b3ff003feac03f5a7e1a78fed7e267842cbc4969637ba7d9dd97f2a2bf8c472b
a07e1fafdcaf39f01c1aa6af6ffdb77736a06eee3c6b792469284c411c664b3f
93cc1bf67971fea6bf3b751fd9ff00e2a699a7eb9accb078374bd0e79e4d521b
9b8d5a4b9d40d8492c9feaedfccf9df1e5f3f273c7d3eb4f1cc16769fb31da78
3b47d2e7bed27c3fa65b4f79169d7f249709776fe5c924579e5a7fabe7f787cc
f5ff009e6f800fb5a8afca8d27f67ff8adab7f60ea7aa699e0987c39f688f50b
c934ebc924bdfecf93cbd9fe8ff68ff59e5c927fcb4aa72fecebf1562b992fa4
d23c216de1cf3ffb43ed3fda127f68ff0063e3fd67d8fed1f7fcbffa69ed401f
a9be2291e3d035278dfcb93ecf218cff00c02bf30be18f8c3c71e06d22ef46b8
f1ff008bfed56b7d2ac967a6ea167e5c11a471c7e6799269dff4d07e42b2357f
d9e7e29e355b8b7d1bc0c7c35fe93a8413cb7f703501a5e24f325fb27da7993c
bffa69ed5876df033e316bde2ef166a7f0ebc29a2dcf86ae2e22d2ad86a5a9fd
8ff791f97fbb8e3f323ff31d007d5ffb0b59f8862f1778faf354f135ff0089ac
2fae64fb2dcdedc2482e3cbbc93f78716f1fcffbcffeb475f6bd7c51ff0004fe
f04c9e05b2d434ebfb18ecbc476904f657e7fe5a7991dc7fabeaff00eafa7e35
f6bd001451450014514500145145003245f314ad7e7a7eceda168fabfc4a1e1f
d1ec34af15dbc7a66a37171a6dddf5c41e4491ea11dbf99e6496ff00bcff0057
247ff2d3f7825fde57dbdf12f5ebdf0a782b56d634f856e6e6c20373e5bc5e60
31a7327c9e626ff937e3915f0f7c149e0f85ff0013f5ebeb1d5b5fb9b8d2adee
34a8edae3c1b2b7996f7979fda1e67171ff3f125cc7fee47f8d002f89bc29a34
1fb4d5868b7d069da2c96fe2bd0c5a68d6b793ca63f32dfccf3239045fbb924f
b349ff002d23fdd8b8ff0059e657e8857e6f78d750b2befda12dfc5b77aeeb76
c12e2cfc5579ff00146491c76ffd971c96f6fcfda7fd5c91de5cff00dfbafba7
e15f8a350f16f82b4fd5b578a3b0d52e6312dc5988fca921df8318923df26c7f
2f612849e4d007ce1f183e1b5bfc45f1778eb58fb4417f7ba06ad676f6fa4d8e
65bc8ee248edbcbe7ccfddf99e6ffd338ffe7a472572b61e2bd2fe06e9d7ba4e
b9e03d375fb9fed8b88e4b98a7fb3c5f6893fd2248fed11c7f67ff00969ff2d3
ecff00f2cff775d37c55d021d57c57f1824b1d7eff0042d4a792cadee7521249
e558796fa5c96f2479fddf99fbc93f2af1dd57e277892cff00692f01e8bac45a
26b765a9f8aedfca1711ff00a469ff006cfb3c92797ff4d3ccb3f33feda5004f
f0c7f68af0c6911786bc57a37843c31a4dbda1d535687cef11c76f717f1dc5c7
96238e3f2ff77266e23ff59ff2ce392bdc17f6e182d65b94bcf0f6876de5c31c
d188bc61677027f32448801b3a7cf28fbf8e927f70d78cea3f1512e7c037da56
b5e1180e81e18d2ef3cbb88ee3f79a9dbc7716f1dcc7ff004cff00e5a47557c4
163e1ff8711ebf16a3f08342f084727869353bfd2fc3d2456f1eaf6725ed9ffa
3c9e5c98ce7cd8fccff9e7249401eeeffb72dad98ff4ad13418ffd1a7b81e5f8
cecee31e5ffcb3fdd799fbca9bfe1b72d61bab7b79f48f0edbc72799995bc676
526cf2e3924ff965e67fcf3af16f1478574bf845e27d3ad2f3e15787fc0971a8
787f55bd92f7c311c76fe7dbc76527da6ca4f2e493fe5a491491c9edff002cea
c0f0269fe129fc1dac43f077c31e00935fb792e34ed57c3b1c71dc5b7fa34927
d9e492393f79fbb93fd67eeffd5d007abc3fb725879713dce89a2dada4904974
92cfe2eb294feee332797e5c7e63f9984c74fbf572d7f6d5b496e6c124d2343b
38eedfca32cbe31d3e48e3ff00ae9e5798ff00a5784e99a4787bc3175e15d574
ff00855a5780dfc4561aacfa66b3a463ed92416fa75c1923b992393f79e60f2e
4ff967fbc4ff00b695abe1df04e85e1e6f87fe2db4f823e1bf06c5afde5bbe8f
ace91147f6cb2327ef23f3248e4fde7996fe67fcb38e803d7ed3f6d7b4bc8ec2
f5fc3fa5da5addbc0a925c78aec331896411c723c79f307df14fd37f6dcb5d51
ad8c7a268b15adc5cfd9e39ee7c5f651e7f79e5f99e5ff00acd9ff006cebc234
7f0a681a5f833c15e3493e0b689a75b6a5aada5a41e278fcafed58ee0cbe5c57
92dc799e649e6489fbc8fcbff969deaf7823c2da56b8967e38ff008547a14bf6
5f1847a7dc78aee7cb935192e3fb445bfda3ccf33ccff58e3f77e5ff00aba00f
603fb72da1d293531e1bd3c581f2cfdabfe12ab3c6cdf8cf97feb3ff0021d7ca
de10f1b7c39f84ff0014ef359f893ab0d37c35a85ebde799a7492491fdb24492
48ff0079671fef13124bfbcaebdfc1fe1cbaf8572fc4083e09e85f66fb4496ff
00f09648f1ff006a7db33e5ff68fda3ccf33ccfb67fcb3f2ff00eda56bf806ee
fc7c67d7fc3f637fa2e876daa79771717ba9471c9fbbb78e4fddc7e647e5c7fb
c93ff21d007cf1e3ed6343d774ebcf107872feff00fe11ab2d424fec896e0482
4fecf92e24f2fcb924fde7fab8ebadf1ff00c4cf845e30d4b57f12f80eef5293
e1dda8d3a3d60c9f6c121fdee2e7fd67ef3fe3dc47feaeba1f885e32d674ff00
158d5bc8d375cf13e97ae59d959c7a769fe65bea1716f25c471f976f1ffcf4f2
ff00e59d751ad78c7c472fc76f0cf853c51af6a1e1fb43693de8bdb6f0dc71ea
923feee33671c7e5c91c9e671fbcff00967feaff00e59d0079d7c59f8a3f09bc
7efe20f12fc3cbed4a4f0458db69f1eaf7327db049e67da63127facfde7fc7b8
ff009675e8df0a35af819fb487ed69e1db7f00dbea3e20f0f695a4ff00685dc5
7d15cc96cb77199111e48ee0fc870f1fef3dbcbff9695e93f167c0b1699e1197
c79e1cb5f197fc2cdd1278e58f4bd6b4c9ef06a1e66638e2fb1db9f23cbe927e
effd5ecfde573bf0bfe276afe31f8c5a8687a9f87b5ad5df49b3b78edadee7c3
9fd97a8d9c97925c5bdcdc491c9e5f996fe5c7e67fcf3ffb691c71d006f7ed32
be1ed67e17d96a1e21f1059f8db40f0e6b126b2351b8fb3f99791dbdef9773a7
c72463ccf3238e3ff591fef3f75ff2d2be73f1ef8bfe1c7c57f17def8afe155e
5fdde8fa7c96e7cd923b8f33ed9e5f97249fe91fbc8ff77e58fddd7ddbe2ef87
9a9f82fc13e28963f1069563e169347bc7d4228f408e392393ecfb23923f2f8f
ddeccfef2393f4af92bc73e29d774db8f0e41aec9a4eaf26976fa7ea16ff00d9
d24727facf2e4fb3dc5c471c71c9feaffd647401c7f8c3e20fc17f897a47843c
3df0c3c417d7baaff67fd9f5b8ee25bcff0057e65bff00cfc7eee4fde7995e55
e01f881f0cfc31f03fc69e09bed4b521f155f5c922d13cafb4797f638ee3fd5f
eeff00d1ff00d5fda3fefe57d51f1406b3a2695e06b7bed4bc2da9c5afdc5bdc
49fd8b676f1cb6724724727eefcb8e3fddfef3fd5c9e65793f803c61e2bb0fd9
1fc7d7f06a7e1eb6d2b44d4750d1ff00b12e6d13ed3791de5e49e649e67facf3
3fd33f77ff005ce8039ef0b7c43f81fe32f82fe14f87971a96a72fc50bcf1046
350b6df79245224971e5cb1f9bfeafcbfb3feeeba4f8c92fc12fd9cbe207ed11
e0336971e19d5750f0fd847e0dd334afb5ec37b259c927fcb2ff00a78fb3ff00
acaf54f0debfe2bd2fe067833c4126bbe1e974eb8d434ed0bfb03fb3e3fb4476
fe64767feb3fd6799ff2d3ccaebbe2f78f3c53a5fc47fda225d2352f0d6996de
0bd2acf594b7d56ce3964d424934ff0033cb93fe99ff00a3f97ff6d2803c17e2
87ecbb20bcf045e7c15f085a41aee8fe1b41afc5369970f1c935c5bdb879233c
fda24d971feaff00e59f99bf8a65ef817e13fc01d37e066bde2ad0a5d08e91ab
de695e37d52c6caeede47b88ecfcc83fd5fef248fcf92dff00791ffacf2fbf4a
f7df096b7e23f8bfa4f846cfe1bf8aa6d0e0d4229350bd3149f639658a2d3ece
de2923f32293f77e647247feafcb93fd67fcf3ac7d4fe25ea43e297c3ff0645a
f69a7c4fe27b890ea1abea16df68b7f2e3d1adfed124727fabf33ed167247ff4
cfcca00f1cf0f783be116bff0001be227c63b5d39eeac63f881711d9ebf2c970
2f22d1fcd8ff00771f3e6731c927fd34f9eb2be297c62f82fe3af8b1a4f893c1
daaea6ff000eece3b78fc4127fa647ff002d3f7bfeb3f79ff1efff003cebe8dd
1fc71e25bbf823e33bcf3fc3a3c47a7fc4bfec64bd8ecffe25efe5fd9adfed12
47ff005cff00795c7fc6af1078afc17f1bbe1ce9716bbe1bd5ee25bb11e9da91
b2411d9fdb3fd1e4fb488ff772797feb23a00f10f1b78afe1ffc58fda1359f17
fc39d5aeef7c3da7e9f65f63924fb4799f68f33cb93fe3e3f791d771acfc4df8
3fe3ff0009786742f879e24bbd4fc4f6fa5f97addb48f70ffbaff47f33ccfb44
7e5c9fbfc55df8e175a968ff001cf5582fafec357934bd1f4af2ee6ca38e28e4
8fed1249e5feeffe9a57a478f25d56d3c13a15edf4fe18be8fc476f15c496da5
59c11c96727991c9fbaf2e38e4f2ff00eba799401e53e18f14fc1ed73c269f07
6faf649fe24de788e38dd7518ee3ec7696f1f9727da3cbff008f7f2e3b78ff00
d5d7d8be28f0fe9bf15fe1d1f0d7886d7ec3a45ce897b1dbf85120b7bc7bf8ed
da311de5b88cfef23198fcb41e5fdf4e9c57947c17d535cf1378a3c12f7179a2
5a5923ea965a659431a3c924905be23fb42797e676964f304bb0797e5ffcb515
ee5e26f0aeada568f2ebde2045f166a52dbc565756be1ed312da53e60f225922
90c9e6227ef2493fd671cd007c51e1af8f7f07f59f87be10f0869bab5fff00c2
d58f5c8fccb117179711c7fe912799fbcff8f793fd1f35a47e317c2197c33178
1a4d7b50ff0085bdfdbfff001ebfe9988ffd27affcfbff00c7bd6ef877e26f89
3c7f651f86ac2d2f12d24d6e5f0f5fea1a47832e24b3b0b7fb4496f1c915c5bc
7fbbb88fcb8e4f33cc923fde7fdfbf60f1f783fc3fe0cf05dde9ba1eb9e25d07
4ab58a441aadfe9f1ea16124f1c7feaee67b88e49238e4c8fde47e5c7cfeee41
d2803e76f127c5ef83bff081ebde08bad5aee5f8b4fac49e4597fa6797e6799f
bbff00a67e5fd9eadf853c77f073e13da788745f8a3e21bad22492cfecfa4458
b83e645fbc8e5ff8f78fcb8ff79e5ffcf3adbd17e24f8dbc47fb3cdbf8b1b463
1d8de5a797716d6fe1ff00323b7b7923f2a4ff0048f2fccfddfef24fb47fabfd
df975d97c39b0d5bc5b67e22b4b06f0bdbc7a47da274975ab4b79247b893bfef
2393f77fbbff00a674015ff67ff1ac7f0deff56f125c580d4ef758ff004778ee
6f23b7b993f791ff00cf4ff59feb2bd96ebf6b282c6474bcf0e5bdb4c13cd8d2
5d6edff7a3cc8e3f93fe072475f3ac57fa6f8a34ff00f89b785ed3c4b65ac789
2e2de4d03f771db5e4924927971fef3fe59f99e5c9ff006ceb535ff04f827e18
b78a346baf855a6785edfec76f71a9e9da779696dae5bc9796fe5c7e5f992797
ff002f11ff00db4a00f7fb6fdaa2c0dddcc1a9e8d6fa6cb198364726af6f23cb
e6c9e5c7b077fde54579fb56d8694f7315fe89058bc76d2dc4425d62dcf9fe5f
97fbb8f6679fde475e0baef85fc0bf0c1bc47e1ebbf84d6ba369d2c1a5cba878
774ef2a3b7d53ccb9f2edbfe5a49ff002d2392392a5f13f807c19f0b757d6b49
ff00855563e13b59f4392e2fedb49f2e38b57b2fb4dbc7e5491c7249fbcff5b1
ff00db5a00f739bf6b08f4928757f0d45a45bc9e67952dc6b76e37f971c921ff
00c723cd40bfb5bdbda599bbd43c350e9b6fe5493896e75ab7f9c47179847fbf
e5f6af1897e1af863e1dea965f65f83da4fc3bbdd5f43d4648f52d3bcbf3248e
3b292492da4f2e493fe5a7952799ff004ce92c3e1ef84fc17a3c7ace99f08b4d
f0259ebfa1dedca5ce9de5f9b259fd9fccfb3c9e5c92799feb2393fe59ff00aa
a00f6db9fdab63b0bbb58f50f0c45a4c77127946e6fb5cb48e38e4f2cc9f3f3c
7dca8adbf6b68e586c6f5fc302dacaf1e0896f6e75bb48e34f371e5efe78fbf5
e24bf0fbc29f0fae343d474df83ba57802f35ad2af6e2c351d3a48bcc448ece4
93c897cb924f30fcf1c9e67fd33aade1af869e0bf093fc3ff1458fc0fd37c2d1
eb1a9d9dbe97af5bc91c9736f24927fcb4fde49e67991a49ff002cff00e5a500
7b4dc7ed629ac68971243e150da6dc47e5a5e9d6edfcb31c8760971f7f667be2
bc5bc39f1b3e1de81e2e87fb47c2d711cd73e17b7b97960d7ee2e43dbc7249e6
5c76e3f79ff5d3fe99d65687e04f01c9e0fd03c787e0969b1457b7a969ff0009
3492462f0ea1e67962f31e67f1dc27fabf2fbd3fc49f162d97e1c6b9e21ff857
7636571e13f0cd99b4b6ba31797a845fda167e5c9e6463f77e67972500775e26
f08c3f13bc55a8dd436ba8695a15dc9a7e85a825b5e5c7c9fbc93ecde67ef23b
8f2e4fb447e67fabff00b695f447c16d297c3d65e22d1c5edaea32e9da81865f
b34be6189fc88a4d927fb7fbccfdc15f297c27f1178abc477fe1db4d4f58d2f4
ab38f5bd122fb35a499f32dad3cb8e3b6ff967f3f99e649ff2d2be98fd9bf4bb
0d334cf130b5bf9efa5b8d423b9bcfb57fac8ee1ede2f313f3c5007947c4ad5d
2d2e3e39692de15d66e5c6afa3eb1f69b28de43a8451ff00677991c588ff00d6
478ffa695e5faefc4cd0a6fda4bc25a7dce99797325df8da4934fb8bbb3f322f
f48934e92292393f83fe3dee3feda56f7c7cfda0bc2ff0ebe2378ff46d67c432
586abfda1656f6f6d8b71f67b793fb3a492e3f79feb3fd5d7cfdac7c72f8667e
277843c431788a7b94d0fc491dec51992dfcafb3dbdc5bc71fef3fe9a4725c49
ff006ce803d9f4eb7f047c4ed2f52f0869da149e1ad77fb0ef06b1addce9dfe8
fa8471f97249e5c9ff002d3cbf2e48ebc87f674f833078ff00e17fc57d68ebba
f5b5b43a4476d3ff00c24d3dc5cdc8b3f36def2392390451e3f776f27eed3ccf
de56af84ff0068cf875e1d1a4ea5178963b99754d1f50d3bec52de5bc7fd9725
e47e67ef3feda547f02ff69587c1bf0a3e22787fc67e2af03dceabac68f1e9da
449a4ea7fbb4f2eda48ffd23ccff00ae91d0053fd92fe10dff00c53d63c4c979
aeebb65a95a7872e218a2f186a33ea1fe8f791c91c7247e65bc7e5fef3fd647f
f5cea3fd8fbe1aaf8ffe2ac36fa6eb3e21b78a0d32e2ef4b93c457b77796f3d9
0924b7cc71496f1f9727991c7fbbf3398f35b3fb367ed471f8135df10ddfc46f
14781aea39f448f4bb3ff847353ffa69ff002d3ccaa3fb30fed333fc36f1d69b
7df107c53f0fefb41d3f48b8d2ecff00b0353ff48f324b9f33f79e67fd749280
25fd963e0c4be39f8bfe26b3b4d7f539868f69aadbd9cbacdc4f7366f1c915c5
9c92d9c725bc71c7fbc923ff00b67599fb257c3d7f17fc73d0f4cb4d6bc4c74d
d3d24bdd324f105f5ddc59ba5bcbe549e55bfd9e34b77fddfeeff79feaff00ef
dd753fb3ff00ed35a37c30f8a5aedf788fc47e0eb8f08fd92f2df48feced5e39
2f23125cf99fe91e61ac5fd9aff6989fe1e7c40d3aebc6de2af879278574cb2b
9b6b7fec9d5317a3cc924923f3379f2ffe5a49401cf7c2bf85573aefed19a5f8
4a3f107894d969de20b88acdee350bb934696f6cfcb92e3cab6fb3f971c7fbc9
3cbfde7fcb3addf0dfc349f4bfdb1adfc309aef89a4b18fc5fe75c496d7d711e
8d25e799f6df2fec7f66d9e5feefcbf33ccff59ff7f299f0e7f68abbf0bfc74b
2d5f55f14f8007802d35cd475411d96aff00f130f2ee23f2e3ff00a67ff2ce3f
fc8956ec3f69e6b4fda35fc41ff094f813fe15d3f8924d63cafed4ff00898e3c
b93fed9ffcb4a00e6b49f83b7d7dfb45c9e014f10f8962b33abdc69d1bfdbeef
fb164d4238fcd93fd0fecffeaffe9a799feb3fefe57a47c68f05fc3583c456a7
c75a6ebbafff006dd9dbde5b693a5dac77052749ef2396e0c9ff002ce3f2e34e
3fbf2560587ed477765f1c0eb375e26f87f2fc3c83c4773acc7126af9d53cb93
ff0021993f771d73df12ff0069b1e28f14784356f016afe12d32e2dfc3fe5dc7
fc251aa471c71f9973249e5feeff00e5a7ef23ff00c89401f55fec8ffb3af872
3f0a5afc43d3d93504b8cdef83ec6f6cdede3d12211bc71f996f9fde5c732799
27fdfbc75afa6bc13e05f0ff00807492ba4e9b6ba7cb731c7f6bb88add2396ee
448f0249303e77ebcd7e60fc25fdabb59f875f093c45a168de33f09699ad6a12
5c49fbdd42de3f2ef24b993ed3736f27ef3ccfddf97e5f99e5c7ff007eff0079
dce89fb74e83ab7876f7c3f27c42b4d32eaeb57b7bfb3d5b6f9525e5b25bc7f6
98ee0491c91da7997117593eff009bfeaf9a00fb9bc53e31f13f84b5abb7beb2
b19bc337422b7b2d5628f9b0b891fcbff4b4328de9e618c663c77af241f0daeb
5ffda6b518b55f124bab35c69d1deea515969890cb1c69731c96d672dc63fe3c
f31c9e5c63e791fed06438af01f02fedaba17877c2fe23ff0084b356b596e7c4
17171aae9fff00091c76f791fd8ff79f668e4fb3ff00cb4f323ff57e5ffd73a7
ea1fb517c2cf0e681aa6b9e0ef1cc9acf8cbc573c86f2fbfb463b331dbbde799
247e5de49e5d9feef31c7fbb92803ea7f8bff0cbc15f13757b9b5f16f882fedd
eded655b88b4eb996d638f4f923fde4778e3e431ff00a3c877c9ff004d00af9b
7e277c21f05f863e22fc51d0ecb4b9fc25a65b699078b64d6ac4c66372f736f1
111db88fee4491cbff005d3cc35e79f1e7e3cdb78afc3bf11b4ff0ef8e741b19
35efecf9f4cf2b5f8e2b71247fbb9648ee24f2e47fddc5e5ff00abf2e4f32bcb
bc33f1963b5d0be327fc25fe21f0fea7e23d7bc3a9a7d85d59788edee224b74f
2fcab78e4924f31fcbf2e4ff00bf9401e9bf063e13fc18f1778fb45b3f06e9de
29d02fee751b4b994ea7a6c7666f2c3ed0ff00eadffe59e64b7ff57ff3cc77ed
72dbf66cf819a878f7c21e0fd73fe12dbaf156b1696f71fdad1da4725b59c979
e65c471f99e5ff00d34ffb67e6475c47c0cfda92fb41f8a7e13d4bc77ab782e5
d36d2dfcb8e4d135b8ff0077fbc924fde79927eeff00d656fe95fb50add7c55f
0b6bd63a8f842d7c0f6ffd9526a116a7af59c7aa799691471c9e5c7e67fd33a0
0ec6c7e0dfecf16ffb42dbe812d8789ad7c43a5eaff66ff849ee6d238adfed96
71c7704799f48cfef3cbadff00dacfc3dfb38ebdf148788fc5c757f155ef886d
23b99351f0dc31ea16d6702491d9c64491ff00d3403e4fde7492bcab51f8e10f
8c7e2b6b4357f10f8023f861aa6b1a85ddc08bc4f67fdaa6dee23f2ffe7af975
87e20f11f85fe1bdc787bc39f087c4be1397c0f67671dbea1278b3c55a7ff68f
fc847ed92797e5c9401eb7ab7c48f825fb27da784d6f3c29a6ebbe28d67488e5
10dd99258ecacb7c92471ac7e549893666392411c7fea87d2b0bc79e11fd9c3c
51e1ef06f8ea6d0afaf7c33e238ee0e9fa4e92925d496fa83dc7ef62ff009e71
c1fe91ff004cfcbfb381ff004cebe6cfda027d57e38fc73d1bc51a0f80fc4da9
687a3e991e9578f1e9125e27da23f3e4ff00967e60ff009691feb5dafc2df8a7
ab7c3ef80de12f0445a7c5e14f1c7862f9ee243e3a923d2ecbf797925c463f79
24727ef23931ff006ca4ff009e7401f5ee8fe00f8052fec7d7fa0c1acdcdbf82
afcc9e2cfec395123d44f9646505affacfbf6fd31d7bd791785fe00fecefe24f
843e33d76dadbc63a368de1811dcea9a54d6318927df1fee8471f593fefe7fac
15c558defc317f05e9de2bd43c51a10f8cfa6786ee346b68a3f13e97fd8be649
249e5c9feb3ccff5721ae9bc31fb45deff00c2a5f89761aef88fe1a5b78bb588
b4c8b463a778aace4b33f67ff9f8f32e7cca00ebfc03fb3cfc34bbf0aeada9f8
21f5ef0fdb1d3ee2331df5bc71fd9ee2cee2ce4ffb691c9f68ac4f867e00f819
27c4ad2742f06e9fad787b57d4efe383cf7d23c88b50b48ef3f7b1c5249249e5
ff00abf33fe7a7974ff04fed63a5db78675ab6f1b6a9e133afdc59ea3263c3fe
23b392cfcb924b3f2e38e492e3fd67fa3c9ff90ebcf7e1ff00ed137d2fc53f86
ba8f8cf52f005b786348bf92f609345f11dbc971ff002f127fa479973fbbff00
5927fdb4f2e803e9df80df02be1f78dfc1fa8f8f6eb4bd4fc1bacdfeb9712417
d6d79fe9b249671c96f2496d2797e67972471c9fbbff00ae95effe1ef0c681aa
f83eff00c37e12f125c1b0d06ea08b759e1ef6daf2dcc724824924ff00592483
eff99ff3d2bf2fbc37f1335cb6f19694da7f8bbc29a6f806cbc523584b3ff84d
ecedee224321fb445e5fda3fd5cb20f33ff6a47e657d0fe1afdacb4cd0bc65e3
2f125cf8d74202ff0058d3cc17306b1a78927b2813cb94f963f7727c92c9fbbf
33cc8f31ff00acf2e803e8cfd9f2ea4f02fc298b57fed8b4d4ecaf75097ed1a5
e99a67d9fc9d42493cb92de3efe67da3224dff00f2d3ccaf67f0ade6b977a7cb
71e22b7b6b39e49dcdbdb400068a2fe0490f98e0c98ebb0e2be2ed37f6a0f80f
f0e3c5104ba078f745beb0d5e28f569748d66f24bdfb25c47f6890c91dc79924
76f3fef238fcbf6fddd67eb7fb5d68cde31d7f51d37e20c1e1cd02fde3d6748b
eb9bcd3fecf2476f2797711f97fbc924f325f33f771fef248fccfde47401f5ff
00887e0ee81a96a8353b2d2ac6cee6ee5963d59228027f69dbcf1f973c771b3f
d6138079fee57c69f1cfe00fc27f00f8ce4b7f89567a978cad5e09750d1e2b5b
192e2e2ced018c491dc48248f7fef07eeffe5a3fef2b7fc4dfb6c699afebf1de
f85fe24f86f4a8ff00b5d2e2cecafae2de34d4f4ef2e3431dc4b2499b6fde799
feb23f33e7ed5e43f16ff68ed46f7e24df6b7e09f117c3fbdbdd574f4b5d5e7f
10788ed2d2338924fb3f9663bd923388f19a00f4fd7be19e8ba9fc15b8bbd33c
4f776fa0c49a878864d5aca37b7b8fb3c779711c7f63f2e3fddc9feafcbae2fe
077c2f9fe257c35f8a935df8a7c45f6982cede2d42ebc59aa5c5e5edbdbc7247
731fd9e4fb3ffabf2e393a799fbca9740fda7bc2307c15b7f0fd8ebfa15a78b2
5f0ddc436ff6dd7f4f8add2f23bcf3e28e593ed1f27facff00d19577e0bfed4c
2c3c23f12a0f1ef883e1fd8ebbac69f1da691fd8de2ad3ee2de4923b6963fdff
009973ff005ce8032fe0a7c337f88bf05fe226b7ab78bfc45222456f2dddf78a
7559ef355b7b38ff00d22392393ecffbbfddff00ab8ff79fbcf32a6fd9dbc037
df13a0f890f71e2bf135cdeda68f1c527fc275aa49792476f71e5dc4724727d9
ff0077fbb8e4f33fd6797279757fe197ed3c965f097e20e99e2fd77c016fe30d
4f4f8ecf478b4cf1669f25949e5db7971f9924973fbbfde545f033f6a71a445f
103fe161eb5f0fec2e750d1edb4bd33fb03c57a7cb1ef8ede48cf99e65cffd73
a00c7fd923c2da97c49f1a6b1696fe2bf14ea37306897634f8fc6babcb7d1496
724725bc7247fe8f1f95fbcf2fcc8ffd679756bf65ff0004dff8dbc61e2fd16d
3c61e22d4ecacf47d42dacff00e129d624b8b2f2ff00e3dfccb78fecd1fd9e3f
33cbff00b67ff2ce97f65afda85bc13e389efbe246b3e00b5d29343934fb3934
0f15e9f732193ed3f68fde79973ff4d24a97f672fda68784b5fd517e216b7e00
b5d0e3d1ee2c34f9745f1769f71712bc92c6f993ccb9fee500617ecb5e13bff8
83f159f4eb7f17f8bf55167a45ec9a447e2fd52e2e6cdedbf7967e6c717d9e3f
2dfccf2ff76fe59f2cd56f803e15bcf147ed11a278720f1a78bee6cf47d624b9
b0b4d5b589ee7469fec727fa4c71dbfd9e3f2ffe5a797e67975b3fb34fed397b
e13f891677bf10f5af8796be1ed3b47b8b3b79345f1769f7372f23dc7989c497
3ff4d25aaff04bf694b8f08fc5dd2e7f146b5f0f21f0369f71a8c915c69de2fd
3e4bcfde799e5feefed3e5ff00cb4a00e5747f035fe99fb4458781dfc6be26fe
cdb1d6020b13aa5c0d0a4d4233f689238ed8dbf11ffacfde7dcf33fe5a7fcb4a
f5fbdf16fc3487e1c78aefb4ed0e7b6d2747f0ed9c7afc57ba74927da248f50b
3fde471c9feb23ff00595e73a8fed1b743e37beab73aaf8025f87b6fe20b8d61
2e2d7c5da7beab2c1fbcf2f11fda7cbf3293c55f12fe1cb781f53f0c5d78f6c6
e5f5fd12cf4f37d6377a64bf60f2f50b793fe7f7f79ff2d0ff00cb3ff57401eb
7f0abe20697a90d12c6d17538e5bbd6fc1f66823b3fb3a79b6f6f17da3ccff00
a67e667feda57d29fb3e78a34df18ea7f12b58d2ecaeeced2e3c479cde0f9ee0
8b3b64f300fee71c7d2be28f877fb46f82f41d3f4795fc6b62b2d86a1a45e491
35ce99fbc8ae248e4b8b7cfdb01cc6f1e7ccedff002d23ef5f61fec95e2fb0f1
6e83e2e9f4ad62d35fd3ad3568eca0beb3fb398dd23b2b6e86de4923ff00c7e8
03de24b48246dd2428e7dd326a3feceb5ff9f683fefd8a28a003fb2ed7fe7d60
ff00bf628fecbb5ff9f583fefd8a28a003fb2ed7fe7d60ff00bf628fecbb5ff9
f583fefd8a28a003fb2ed7fe7d60ff00bf628fecbb5ff9f583fefd8a28a003fb
2ed7fe7d60ff00bf628fecbb5ff9f583fefd8a28a003fb2acbfe7d61ff00bf62
8fecbb5ff9f583fefd8a28a003fb2acbfe7d61ff00bf6299fd8b61ff003e707f
dfba28a0068d234d8c7cb616bf84494efec5b0ff009f383fefdd145003bfb1ac
3fe7ce0ffbf62a2fec3d3bfe81f69ff7e128a2800fec3d3bfe81f69ff7e1297f
e11fd2ff00e81769ff007e13fc28a2800fec1d353ee699683e9025793fc4afd9
bf45f8c9aac31f8c2ee5d5fc290cb1dca786638120b591e3fb86e0f2f27d38a2
8a00f58d1f49b2d074fb7b0d3ad61b2b1b78f6416f6e9b1234f402b88f8c3f00
fc19f1cb4db6b4f156971dccf64fe7d86a10feeeeece5fefc72763451401a3e0
6f00c9e1ad0e3b1d62fa0f12dc47c25f5cd8471c847fb78ae8ff00e11ed2bfe8
1967ff0080e9fe1451400efec1d37fe81969ff007e128fec1d37fe81969ff7e1
28a2801bff0008f695ff0040cb3ffc074ff0a4ff00847749ff00a0558ffe0325
145002ff00c23da57fd032cfff0001d3fc293fe11ad1bfe81163ff0080d1ff00
85145002ff00c23da57fd032cfff0001d3fc293fe11ad1bfe81163ff0080d1ff
0085145001ff0008d68dff00408b1ffc068ffc293fe119d193fe613623fedd93
fc28a28017fe11ad1bfe81163ff80d1ff851ff0008d68dff00408b1ffc068ffc
28a28023ff00844b44ff00a0269fff008091ff00851ff089689ff404d3ff00f0
123ff0a28a003fe112d13fe809a7ff00e0247fe147fc21fa1ffd0174dffc038f
fc28a28013fe10dd03fe805a6ffe01c7fe147fc21ba07fd00b4dff00c038ff00
c28a28019ff086e81ff402d33ff0123ff0ad0b0d2ed74bb7f26d2da1b68bfe79
dbc6231fa5145007ffd9}}\par\pard\plain\s1\nooverflow\nocwrap\lnbrkrule\sl240\slmult1\sb6\f0\fs13\b0\i0\par\pard\plain\s1\nooverflow\nocwrap\lnbrkrule\li2038\fi2\ri2045\qc\sl240\slmult1\sb89\f0\fs28\b0 \uc1\u1052 ?\uc1\u1110 ?\uc1\u1085 ?\uc1\u1110 ?\uc1\u1089 ?\uc1\u1090 ?\uc1\u1077 ?\uc1\u1088 ?\uc1\u1089 ?\uc1\u1090 ?\uc1\u1074 ?\uc1\u1086 ? \uc1\u1086 ?\uc1\u1089 ?\uc1\u1074 ?\uc1\u1110 ?\uc1\u1090 ?\uc1\u1080 ? \uc1\u1110 ? \uc1\u1085 ?\uc1\u1072 ?\uc1\u1091 ?\uc1\u1082 ?\uc1\u1080 ? \uc1\u1059 ?\uc1\u1082 ?\uc1\u1088 ?\uc1\u1072 ?\uc1\u1111 ?\uc1\u1085 ?\uc1\u1080 ? \uc1\u1053 ?\uc1\u1072 ?\uc1\u1094 ?\uc1\u1110 ?\uc1\u1086 ?\uc1\u1085 ?\uc1\u1072 ?\uc1\u1083 ?\uc1\u1100 ?\uc1\u1085 ?\uc1\u1080 ?\uc1\u1081 ? \uc1\u1090 ?\uc1\u1077 ?\uc1\u1093 ?\uc1\u1085 ?\uc1\u1110 ?\uc1\u1095 ?\uc1\u1085 ?\uc1\u1080 ?\uc1\u1081 ? \uc1\u1091 ?\uc1\u1085 ?\uc1\u1110 ?\uc1\u1074 ?\uc1\u1077 ?\uc1\u1088 ?\uc1\u1089 ?\uc1\u1080 ?\uc1\u1090 ?\uc1\u1077 ?\uc1\u1090 ? \uc1\u1059 ?\uc1\u1082 ?\uc1\u1088 ?\uc1\u1072 ?\uc1\u1111 ?\uc1\u1085 ?\uc1\u1080 ?\par\pard\plain\s1\nooverflow\nocwrap\lnbrkrule\li2539\ri2547\qc\sl240\slmult1\f0\fs28\b0 \'AB\uc1\u1050 ?\uc1\u1080 ?\uc1\u1111 ?\uc1\u1074 ?\uc1\u1089 ?\uc1\u1100 ?\uc1\u1082 ?\uc1\u1080 ?\uc1\u1081 ? \uc1\u1087 ?\uc1\u1086 ?\uc1\u1083 ?\uc1\u1110 ?\uc1\u1090 ?\uc1\u1077 ?\uc1\u1093 ?\uc1\u1085 ?\uc1\u1110 ?\uc1\u1095 ?\uc1\u1085 ?\uc1\u1080 ?\uc1\u1081 ? \uc1\u1110 ?\uc1\u1085 ?\uc1\u1089 ?\uc1\u1090 ?\uc1\u1080 ?\uc1\u1090 ?\uc1\u1091 ?\uc1\u1090 ? \uc1\u1110 ?\uc1\u1084 ?. \uc1\u1030 ?.\uc1\u1030 ?.\uc1\u1057 ?\uc1\u1110 ?\uc1\u1082 ?\uc1\u1086 ?\uc1\u1088 ?\uc1\u1089 ?\uc1\u1100 ?\uc1\u1082 ?\uc1\u1086 ?\uc1\u1075 ?\uc1\u1086 ?\'BB\par\pard\plain\s1\nooverflow\nocwrap\lnbrkrule\li2539\ri2543\qc\sl240\slmult1\sb1\f0\fs28\b0 \uc1\u1053 ?\uc1\u1072 ?\uc1\u1074 ?\uc1\u1095 ?\uc1\u1072 ?\uc1\u1083 ?\uc1\u1100 ?\uc1\u1085 ?\uc1\u1086 ?-\uc1\u1085 ?\uc1\u1072 ?\uc1\u1091 ?\uc1\u1082 ?\uc1\u1086 ?\uc1\u1074 ?\uc1\u1080 ?\uc1\u1081 ? \uc1\u1082 ?\uc1\u1086 ?\uc1\u1084 ?\uc1\u1087 ?\uc1\u1083 ?\uc1\u1077 ?\uc1\u1082 ?\uc1\u1089 ?\par\pard\plain\s1\nooverflow\nocwrap\lnbrkrule\li1835\ri1839\qc\sl240\slmult1\f0\fs28\b0 \'AB\uc1\u1030 ?\uc1\u1085 ?\uc1\u1089 ?\uc1\u1090 ?\uc1\u1080 ?\uc1\u1090 ?\uc1\u1091 ?\uc1\u1090 ? \uc1\u1087 ?\uc1\u1088 ?\uc1\u1080 ?\uc1\u1082 ?\uc1\u1083 ?\uc1\u1072 ?\uc1\u1076 ?\uc1\u1085 ?\uc1\u1086 ?\uc1\u1075 ?\uc1\u1086 ? \uc1\u1089 ?\uc1\u1080 ?\uc1\u1089 ?\uc1\u1090 ?\uc1\u1077 ?\uc1\u1084 ?\uc1\u1085 ?\uc1\u1086 ?\uc1\u1075 ?\uc1\u1086 ? \uc1\u1072 ?\uc1\u1085 ?\uc1\u1072 ?\uc1\u1083 ?\uc1\u1110 ?\uc1\u1079 ?\uc1\u1091 ?\'BB\par\pard\plain\s1\nooverflow\nocwrap\lnbrkrule\sl240\slmult1\f0\fs30\b0\i0\par\pard\plain\s1\nooverflow\nocwrap\lnbrkrule\sl240\slmult1\f0\fs30\b0\i0\par\pard\plain\s1\nooverflow\nocwrap\lnbrkrule\sl240\slmult1\f0\fs30\b0\i0\par\pard\plain\s1\nooverflow\nocwrap\lnbrkrule\sl240\slmult1\f0\fs30\b0\i0\par\pard\plain\s1\nooverflow\nocwrap\lnbrkrule\sl240\slmult1\f0\fs30\b0\i0\par\pard\plain\s1\nooverflow\nocwrap\lnbrkrule\sl240\slmult1\f0\fs30\b0\i0\par\pard\plain\s1\nooverflow\nocwrap\lnbrkrule\sl240\slmult1\sb2\f0\fs37\b0\i0\par\pard\plain\s2\nooverflow\nocwrap\lnbrkrule\li2539\ri1834\qc\sl240\slmult1\f0\fs32\b0\cf1 \uc1\u1051 ?\uc1\u1072 ?\uc1\u1073 ?\uc1\u1086 ?\uc1\u1088 ?\uc1\u1072 ?\uc1\u1090 ?\uc1\u1086 ?\uc1\u1088 ?\uc1\u1085 ?\uc1\u1072 ? \uc1\u1088 ?\uc1\u1086 ?\uc1\u1073 ?\uc1\u1086 ?\uc1\u1090 ?\uc1\u1072 ? \uc1\u8470 ?1\par\pard\plain\s1\nooverflow\nocwrap\lnbrkrule\li2539\ri1839\qc\sl240\slmult1\sb9\f0\fs32\b0\cf1 \uc1\u1079 ? \uc1\u1076 ?\uc1\u1080 ?\uc1\u1089 ?\uc1\u1094 ?\uc1\u1080 ?\uc1\u1087 ?\uc1\u1083 ?\uc1\u1110 ?\uc1\u1085 ?\uc1\u1080 ?: \'93\uc1\u1050 ?\uc1\u1086 ?\uc1\u1084 ?\uc1\u1087 ?\'92\uc1\u1102 ?\uc1\u1090 ?\uc1\u1077 ?\uc1\u1088 ?\uc1\u1085 ?\uc1\u1110 ? \uc1\u1084 ?\uc1\u1077 ?\uc1\u1088 ?\uc1\u1077 ?\uc1\u1078 ?\uc1\u1110 ? \'94\par\pard\plain\s1\nooverflow\nocwrap\lnbrkrule\sl240\slmult1\f0\fs34\b0\i0\par\pard\plain\s1\nooverflow\nocwrap\lnbrkrule\sl240\slmult1\f0\fs34\b0\i0\par\pard\plain\s1\nooverflow\nocwrap\lnbrkrule\sl240\slmult1\f0\fs34\b0\i0\par\pard\plain\s1\nooverflow\nocwrap\lnbrkrule\sl240\slmult1\f0\fs34\b0\i0\par\pard\plain\s1\nooverflow\nocwrap\lnbrkrule\sl240\slmult1\f0\fs34\b0\i0\par\pard\plain\s1\nooverflow\nocwrap\lnbrkrule\sl240\slmult1\sb7\f0\fs30\b0\i0\par\pard\plain\s1\nooverflow\nocwrap\lnbrkrule\li5771\fi-8\ri95\sl240\slmult1\f1\fs28\b1 \uc1\u1042 ?\uc1\u1080 ?\uc1\u1082 ?\uc1\u1086 ?\uc1\u1085 ?\uc1\u1072 ?\uc1\u1083 ?\uc1\u1072 ?: \f0\fs28\b0\i0 \uc1\u1089 ?\uc1\u1090 ?\uc1\u1091 ?\uc1\u1076 ?\uc1\u1077 ?\uc1\u1085 ?\uc1\u1090 ?\uc1\u1082 ?\uc1\u1072 ? I\uc1\u8545 ? \uc1\u1082 ?\uc1\u1091 ?\uc1\u1088 ?\uc1\u1089 ?\uc1\u1091 ? \uc1\u1075 ?\uc1\u1088 ?\uc1\u1091 ?\uc1\u1087 ?\uc1\u1080 ? \uc1\u1050 ?\uc1\u1040 ?-74\par\pard\plain\s1\nooverflow\nocwrap\lnbrkrule\li5771\sl-322\f0\fs28\b0 \uc1\u1051 ?\uc1\u1102 ?\uc1\u1090 ?\uc1\u1072 ? \uc1\u1042 ?.\uc1\u1054 ?.\par\pard\plain\s1\nooverflow\nocwrap\lnbrkrule\li5757\sl240\slmult1\f1\fs28\b1 \uc1\u1055 ?\uc1\u1088 ?\uc1\u1080 ?\uc1\u1081 ?\uc1\u1085 ?\uc1\u1103 ?\uc1\u1074 ?: \f0\fs28\b0\i0 \uc1\u1050 ?\uc1\u1091 ?\uc1\u1093 ?\uc1\u1072 ?\uc1\u1088 ?\uc1\u1108 ?\uc1\u1074 ? \uc1\u1057 ?.\uc1\u1054 ?\par\pard\plain\s1\nooverflow\nocwrap\lnbrkrule\sl240\slmult1\f0\fs30\b0\i0\par\pard\plain\s1\nooverflow\nocwrap\lnbrkrule\sl240\slmult1\f0\fs30\b0\i0\par\pard\plain\s1\nooverflow\nocwrap\lnbrkrule\sl240\slmult1\f0\fs30\b0\i0\par\pard\plain\s1\nooverflow\nocwrap\lnbrkrule\sl240\slmult1\f0\fs30\b0\i0\par\pard\plain\s1\nooverflow\nocwrap\lnbrkrule\sl240\slmult1\f0\fs30\b0\i0\par\pard\plain\s1\nooverflow\nocwrap\lnbrkrule\sl240\slmult1\f0\fs30\b0\i0\par\pard\plain\s1\nooverflow\nocwrap\lnbrkrule\sl240\slmult1\f0\fs30\b0\i0\par\pard\plain\s1\nooverflow\nocwrap\lnbrkrule\sl240\slmult1\f0\fs30\b0\i0\par\pard\plain\s1\nooverflow\nocwrap\lnbrkrule\li2431\ri2671\qc\sl240\slmult1\sb243\f0\fs28\b0\cf1 \uc1\u1050 ?\uc1\u1080 ?\uc1\u1111 ?\uc1\u1074 ?-2020\uc1\u1088 ?\par\sect\sectd\sbkpage\margtsxn1040\pard\plain\s3\nooverflow\nocwrap\lnbrkrule\li102\sl240\slmult1\sb69\f1\fs28\b1\cf1 Lab_1_Request\par\pard\plain\s1\nooverflow\nocwrap\lnbrkrule\li102\sl240\slmult1\sb185\tx809\tx2226\tx4350\tx6474\tx7891\tx8599\f0\fs28\b0\cf1 140\tab 8.138262\tab 192.168.0.100\tab 128.119.245.12\tab HTTP\tab 602\tab \f0\fs28\b0\i0\expnd0\expndtw-2 GET\par\pard\plain\s1\nooverflow\nocwrap\lnbrkrule\li102\sl240\slmult1\sb50\f0\fs28\b0\cf1 /wireshark-labs/INTRO-wireshark-file1.html HTTP/1.1\par\pard\plain\s1\nooverflow\nocwrap\lnbrkrule\li102\ri717\sl278\slmult1\sb247\f0\fs28\b0\cf1 Frame 140: 602 bytes on wire (4816 bits), 602 bytes captured (4816 bits) on interface \'5CDevice\'5CNPF_\'7B72CF045B-7343-40C7-B33B-B5654663C87B\'7D, id 0\par\pard\plain\s1\nooverflow\nocwrap\lnbrkrule\li102\ri427\sl278\slmult1\sb194\f0\fs28\b0\cf1 Ethernet II, Src: 42:9f:54:41:b6:99 (42:9f:54:41:b6:99), Dst: Tp-LinkT_ae:15:aa (30:b5:c2:ae:15:aa)\par\pard\plain\s1\nooverflow\nocwrap\lnbrkrule\li102\sl240\slmult1\sb196\f0\fs28\b0\cf1 Internet Protocol Version 4, Src: 192.168.0.100, Dst: 128.119.245.12\par\pard\plain\s1\nooverflow\nocwrap\lnbrkrule\li102\ri348\sl278\slmult1\sb245\f0\fs28\b0\cf1 Transmission Control Protocol, Src Port: 5359, Dst Port: 80, Seq: 1, Ack: 1, Len: 548\par\pard\plain\s1\nooverflow\nocwrap\lnbrkrule\li102\sl240\slmult1\sb196\f0\fs28\b0\cf1 Hypertext Transfer Protocol\par\pard\plain\s1\nooverflow\nocwrap\lnbrkrule\li658\fi-279\ri1923\sl424\slmult1\sb250\f0\fs28\b0\cf1 GET /wireshark-labs/INTRO-wireshark-file1.html HTTP/1.1\'5Cr\'5Cn Request Method: GET\par\pard\plain\s1\nooverflow\nocwrap\lnbrkrule\li658\ri2243\sl427\slmult1\f0\fs28\b0\cf1 Request URI: /wireshark-labs/INTRO-wireshark-file1.html Request Version: HTTP/1.1\par\pard\plain\s1\nooverflow\nocwrap\lnbrkrule\li380\ri6090\sl424\slmult1\f0\fs28\b0\cf1 Host: gaia.cs.umass.edu\'5Cr\'5Cn Connection: keep-alive\'5Cr\'5Cn\par\pard\plain\s1\nooverflow\nocwrap\lnbrkrule\li102\fi278\ri118\sl278\slmult1\f0\fs28\b0\cf1 User-Agent: Mozilla/5.0 (Windows NT 10.0; Win64; x64) AppleWebKit/537.36 (KHTML, like Gecko) Chrome/79.0.3945.130 Safari/537.36\'5Cr\'5Cn\par\pard\plain\s1\nooverflow\nocwrap\lnbrkrule\li380\sl240\slmult1\sb188\f0\fs28\b0\cf1 Accept: image/webp,image/apng,image/*,*/*;q=0.8\'5Cr\'5Cn\par\pard\plain\s1\nooverflow\nocwrap\lnbrkrule\li102\fi278\ri1550\sl278\slmult1\sb248\f0\fs28\b0\cf1 Referer: {\field {\fldinst { HYPERLINK "http://gaia.cs.umass.edu/wireshark-labs/INTRO-wireshark-" }}{\fldrslt \f0\fs28\b0\i0 http://gaia.cs.umass.edu/wireshark-labs/INTRO-wireshark-}}
\f0\fs28\b0\i0  file1.html\'5Cr\'5Cn\par\pard\plain\s1\nooverflow\nocwrap\lnbrkrule\li380\sl240\slmult1\sb196\f0\fs28\b0\cf1 Accept-Encoding: gzip, deflate\'5Cr\'5Cn\par\pard\plain\s1\nooverflow\nocwrap\lnbrkrule\li380\sl240\slmult1\sb247\f0\fs28\b0\cf1 Accept-Language: ru-RU,ru;q=0.9,en-US;q=0.8,en;q=0.7,uk;q=0.6\'5Cr\'5Cn\par\pard\plain\s1\nooverflow\nocwrap\lnbrkrule\li380\sl240\slmult1\sb249\f0\fs28\b0\cf1 \'5Cr\'5Cn\par\pard\plain\s1\nooverflow\nocwrap\lnbrkrule\li102\fi278\ri336\sl278\slmult1\sb247\f0\fs28\b0\cf1 [Full request URI: {\field {\fldinst { HYPERLINK "http://gaia.cs.umass.edu//wireshark-labs/INTRO-wireshark-" }}{\fldrslt \f0\fs28\b0\i0 http://gaia.cs.umass.edu//wireshark-labs/INTRO-wireshark-}}
\f0\fs28\b0\i0  file1.html]\par\pard\plain\s1\nooverflow\nocwrap\lnbrkrule\li380\sl240\slmult1\sb196\f0\fs28\b0\cf1 [HTTP request 1/1]\par\sect\sectd\sbkpage\margtsxn1040\pard\plain\s1\nooverflow\nocwrap\lnbrkrule\li380\sl240\slmult1\sb69\f0\fs28\b0\cf1 [Response in frame: 142]\par\pard\plain\s3\nooverflow\nocwrap\lnbrkrule\li102\sl240\slmult1\sb253\f1\fs28\b1\cf1 Lab_1_answer\par\pard\plain\s1\nooverflow\nocwrap\lnbrkrule\li102\sl240\slmult1\sb155\tx809\tx2226\tx6474\tx7891\f0\fs28\b0\cf1 142\tab 8.282876\tab gaia.cs.umass.edu\expnd7\expndtw35  \f0\fs28\b0\i0\expnd0\expndtw0 192.168.0.100\tab HTTP293\tab HTTP/1.1\par\pard\plain\s1\nooverflow\nocwrap\lnbrkrule\li102\sl240\slmult1\sb50\f0\fs28\b0\cf1 304 Not Modified\par\pard\plain\s1\nooverflow\nocwrap\lnbrkrule\li102\ri593\sl278\slmult1\sb247\f0\fs28\b0\cf1 Frame 142: 293 bytes on wire (2344 bits), 293 bytes captured (2344 bits) on interface \'5CDevice\'5CNPF_\'7B757FB211-E844-42C4-AB8F-4EBE3EEE88C0\'7D, id 0\par\pard\plain\s1\nooverflow\nocwrap\lnbrkrule\li102\ri427\sl278\slmult1\sb194\f0\fs28\b0\cf1 Ethernet II, Src: 42:9f:54:41:b6:99 (42:9f:54:41:b6:99), Dst: Tp-LinkT_ae:15:aa (30:b5:c2:ae:15:aa)\par\pard\plain\s1\nooverflow\nocwrap\lnbrkrule\li102\ri1103\sl278\slmult1\sb194\f0\fs28\b0\cf1 Internet Protocol Version 4, Src: gaia.cs.umass.edu (128.119.245.12), Dst: 192.168.0.107 (192.168.0.107)\par\pard\plain\s1\nooverflow\nocwrap\lnbrkrule\li102\ri147\sl278\slmult1\sb192\f0\fs28\b0\cf1 Transmission Control Protocol, Src Port: http (80), Dst Port: 58495 (58495), Seq: 1, Ack: 549, Len: 239\par\pard\plain\s1\nooverflow\nocwrap\lnbrkrule\li380\fi-279\ri5571\sl424\slmult1\sb196\f0\fs28\b0\cf1 Hypertext Transfer Protocol HTTP/1.1 304 Not\expnd-2\expndtw-10  \f0\fs28\b0\i0\expnd0\expndtw0 Modified\'5Cr\'5Cn\par\pard\plain\s1\nooverflow\nocwrap\lnbrkrule\li658\ri1730\sl424\slmult1\sb3\f0\fs28\b0\cf1 [Expert Info (Chat/Sequence): HTTP/1.1 304 Not Modified\'5Cr\'5Cn] Response Version: HTTP/1.1\par\pard\plain\s1\nooverflow\nocwrap\lnbrkrule\li658\sl240\slmult1\f0\fs28\b0\cf1 Status Code: 304\par\pard\plain\s1\nooverflow\nocwrap\lnbrkrule\li658\ri4303\sl424\slmult1\sb247\f0\fs28\b0\cf1 [Status Code Description: Not Modified] Response Phrase: Not Modified\par\pard\plain\s1\nooverflow\nocwrap\lnbrkrule\li380\sl240\slmult1\sb3\f0\fs28\b0\cf1 Date: Wed, 12 Feb 2020 01:38:39 GMT\'5Cr\'5Cn\par\pard\plain\s1\nooverflow\nocwrap\lnbrkrule\li102\fi278\ri1843\sl278\slmult1\sb245\f0\fs28\b0\cf1 Server: Apache/2.4.6 (CentOS) OpenSSL/1.0.2k-fips PHP/5.4.16 mod_perl/2.0.11 Perl/v5.16.3\'5Cr\'5Cn\par\pard\plain\s1\nooverflow\nocwrap\lnbrkrule\li380\sl240\slmult1\sb196\f0\fs28\b0\cf1 Connection: Keep-Alive\'5Cr\'5Cn\par\pard\plain\s1\nooverflow\nocwrap\lnbrkrule\li380\ri4973\sl424\slmult1\sb249\f0\fs28\b0\cf1 Keep-Alive: timeout=5, max=100\'5Cr\'5Cn ETag: "51-59e4764021908"\'5Cr\'5Cn\par\pard\plain\s1\nooverflow\nocwrap\lnbrkrule\li380\sl240\slmult1\f0\fs28\b0\cf1 \'5Cr\'5Cn\par\pard\plain\s1\nooverflow\nocwrap\lnbrkrule\li380\sl240\slmult1\sb250\f0\fs28\b0\cf1 [HTTP response 1/1]\par\pard\plain\s1\nooverflow\nocwrap\lnbrkrule\li380\sl240\slmult1\sb247\f0\fs28\b0\cf1 [Time since request: 0.203593000 seconds]\par\sect\sectd\sbkpage\margtsxn1040\pard\plain\s1\nooverflow\nocwrap\lnbrkrule\ri6512\qr\sl240\slmult1\sb69\f0\fs28\b0\cf1 [Request in frame: 142]\par\pard\plain\s1\nooverflow\nocwrap\lnbrkrule\li102\fi278\ri842\sl278\slmult1\sb248\f0\fs28\b0\cf1 [Request URI: {\field {\fldinst { HYPERLINK "http://gaia.cs.umass.edu/wireshark-labs/INTRO-wireshark-" }}{\fldrslt \f0\fs28\b0\i0 http://gaia.cs.umass.edu/wireshark-labs/INTRO-wireshark-}}
\f0\fs28\b0\i0  file1.html]\par\pard\plain\s1\nooverflow\nocwrap\lnbrkrule\sl240\slmult1\f0\fs30\b0\i0\par\pard\plain\s1\nooverflow\nocwrap\lnbrkrule\sl240\slmult1\f0\fs39\b0\i0\par\pard\plain\s3\nooverflow\nocwrap\lnbrkrule\ri6490\qr\sl240\slmult1\f1\fs28\b1 \uc1\u1050 ?\uc1\u1086 ?\uc1\u1085 ?\uc1\u1090 ?\uc1\u1088 ?\uc1\u1086 ?\uc1\u1083 ?\uc1\u1100 ?\uc1\u1085 ?\uc1\u1110 ? \uc1\u1079 ?\uc1\u1072 ?\uc1\u1087 ?\uc1\u1080 ?\uc1\u1090 ?\uc1\u1072 ?\uc1\u1085 ?\uc1\u1085 ?\uc1\u1103 ?:\par\pard\plain\s4\ls1\ilvl0\nooverflow\nocwrap\lnbrkrule\li102\fi359\ri142\sl278\slmult1\sb242\tx810\f0\fs28\b0 \uc1\u1071 ?\uc1\u1082 ?\uc1\u1110 ? \uc1\u1087 ?\uc1\u1088 ?\uc1\u1086 ?\uc1\u1090 ?\uc1\u1086 ?\uc1\u1082 ?\uc1\u1086 ?\uc1\u1083 ?\uc1\u1080 ? \uc1\u1074 ?\uc1\u1110 ?\uc1\u1076 ?\uc1\u1086 ?\uc1\u1073 ?\uc1\u1088 ?\uc1\u1072 ?\uc1\u1078 ?\uc1\u1072 ?\uc1\u1083 ?\uc1\u1080 ?\uc1\u1089 ?\uc1\u1103 ? \uc1\u1074 ? \uc1\u1074 ?\uc1\u1110 ?\uc1\u1082 ?\uc1\u1085 ?\uc1\u1110 ? \uc1\u1083 ?\uc1\u1110 ?\uc1\u1089 ?\uc1\u1090 ?\uc1\u1080 ?\uc1\u1085 ?\uc1\u1075 ?\uc1\u1091 ? \uc1\u1087 ?\uc1\u1088 ?\uc1\u1086 ?\uc1\u1090 ?\uc1\u1086 ?\uc1\u1082 ?\uc1\u1086 ?\uc1\u1083 ?\uc1\u1110 ?\uc1\u1074 ? \uc1\u1076 ?\uc1\u1086 ? \uc1\u1074 ?\uc1\u1082 ?\uc1\u1083 ?\uc1\u1102 ?\uc1\u1095 ?\uc1\u1077 ?\uc1\u1085 ?\uc1\u1085 ?\uc1\u1103 ? \uc1\u1092 ?\uc1\u1110 ?\uc1\u1083 ?\uc1\u1100 ?\uc1\u1090 ?\uc1\u1088 ?\uc1\u1072 ?\uc1\u1094 ?\uc1\u1110 ?\uc1\u1111 ??\par\pard\plain\s1\nooverflow\nocwrap\lnbrkrule\li102\ri8472\sl424\slmult1\sb197\f0\fs28\b0 ARP \f0\fs28\b0\i0\expnd0\expndtw-2 DNS \f0\fs28\b0\i0\expnd0\expndtw0 HTTP MDNS SSL TCP TLSv1.2 UPD\par\pard\plain\s4\ls1\ilvl0\nooverflow\nocwrap\lnbrkrule\li102\fi359\ri809\sl278\slmult1\sb1\tx810\f0\fs28\b0 \uc1\u1071 ?\uc1\u1082 ?\uc1\u1110 ? \uc1\u1087 ?\uc1\u1088 ?\uc1\u1086 ?\uc1\u1090 ?\uc1\u1086 ?\uc1\u1082 ?\uc1\u1086 ?\uc1\u1083 ?\uc1\u1080 ? \uc1\u1074 ?\uc1\u1080 ?\uc1\u1082 ?\uc1\u1086 ?\uc1\u1088 ?\uc1\u1080 ?\uc1\u1089 ?\uc1\u1090 ?\uc1\u1086 ?\uc1\u1074 ?\uc1\u1091 ?\uc1\u1074 ?\uc1\u1072 ?\uc1\u1083 ?\uc1\u1080 ?\uc1\u1089 ?\uc1\u1103 ? \uc1\u1074 ? \uc1\u1079 ?\uc1\u1073 ?\uc1\u1077 ?\uc1\u1088 ?\uc1\u1077 ?\uc1\u1078 ?\uc1\u1077 ?\uc1\u1085 ?\uc1\u1080 ?\uc1\u1093 ? \uc1\u1087 ?\uc1\u1072 ?\uc1\u1082 ?\uc1\u1077 ?\uc1\u1090 ?\uc1\u1072 ?\uc1\u1093 ? \uc1\u1079 ?\uc1\u1072 ?\uc1\u1087 ?\uc1\u1080 ?\uc1\u1090 ?\uc1\u1091 ?\expnd-6\expndtw-28  \f0\fs28\b0\i0\expnd0\expndtw0 \uc1\u1090 ?\uc1\u1072 ? \uc1\u1074 ?\uc1\u1110 ?\uc1\u1076 ?\uc1\u1087 ?\uc1\u1086 ?\uc1\u1074 ?\uc1\u1110 ?\uc1\u1076 ?\uc1\u1110 ??\par\pard\plain\s1\nooverflow\nocwrap\lnbrkrule\li102\sl240\slmult1\sb194\f0\fs28\b0 HTTP\par\pard\plain\s4\ls1\ilvl0\nooverflow\nocwrap\lnbrkrule\li102\fi359\ri385\sl278\slmult1\sb247\tx810\f0\fs28\b0 \uc1\u1071 ?\uc1\u1082 ?\uc1\u1080 ?\uc1\u1081 ? \uc1\u1087 ?\uc1\u1077 ?\uc1\u1088 ?\uc1\u1110 ?\uc1\u1086 ?\uc1\u1076 ? \uc1\u1095 ?\uc1\u1072 ?\uc1\u1089 ?\uc1\u1091 ? \uc1\u1087 ?\uc1\u1088 ?\uc1\u1086 ?\uc1\u1081 ?\uc1\u1096 ?\uc1\u1086 ?\uc1\u1074 ? \uc1\u1079 ? \uc1\u1095 ?\uc1\u1072 ?\uc1\u1089 ?\uc1\u1091 ? \uc1\u1074 ?\uc1\u1110 ?\uc1\u1076 ?\uc1\u1089 ?\uc1\u1080 ?\uc1\u1083 ?\uc1\u1082 ?\uc1\u1080 ? \uc1\u1087 ?\uc1\u1077 ?\uc1\u1088 ?\uc1\u1096 ?\uc1\u1086 ?\uc1\u1075 ?\uc1\u1086 ? \uc1\u1087 ?\uc1\u1072 ?\uc1\u1082 ?\uc1\u1077 ?\uc1\u1090 ?\uc1\u1091 ? \uc1\u1110 ?\uc1\u1079 ? \uc1\u1079 ?\uc1\u1072 ?\uc1\u1087 ?\uc1\u1080 ?\uc1\u1090 ?\uc1\u1086 ?\uc1\u1084 ? \uc1\u1089 ?\uc1\u1090 ?\uc1\u1086 ?\uc1\u1088 ?\uc1\u1110 ?\uc1\u1085 ?\uc1\u1082 ?\uc1\u1080 ? \uc1\u1076 ?\uc1\u1086 ? \uc1\u1086 ?\uc1\u1090 ?\uc1\u1088 ?\uc1\u1080 ?\uc1\u1084 ?\uc1\u1072 ?\uc1\u1085 ?\uc1\u1085 ?\uc1\u1103 ? \uc1\u1087 ?\uc1\u1077 ?\uc1\u1088 ?\uc1\u1096 ?\uc1\u1086 ?\uc1\u1075 ?\uc1\u1086 ? \uc1\u1087 ?\uc1\u1072 ?\uc1\u1082 ?\uc1\u1077 ?\uc1\u1090 ?\uc1\u1091 ? \uc1\u1079 ? \uc1\u1074 ?\uc1\u1110 ?\uc1\u1076 ?\uc1\u1087 ?\uc1\u1086 ?\uc1\u1074 ?\uc1\u1110 ?\uc1\u1076 ?\uc1\u1076 ?\uc1\u1102 ?\expnd-3\expndtw-14  \f0\fs28\b0\i0\expnd0\expndtw0 \uc1\u1089 ?\uc1\u1077 ?\uc1\u1088 ?\uc1\u1074 ?\uc1\u1077 ?\uc1\u1088 ?\uc1\u1072 ??\par\pard\plain\s1\nooverflow\nocwrap\lnbrkrule\li102\sl240\slmult1\sb197\f0\fs28\b0 27.998436 \'96 27.794843 = 0.203593\par\pard\plain\s4\ls1\ilvl0\nooverflow\nocwrap\lnbrkrule\li102\fi359\ri1360\sl278\slmult1\sb247\tx810\f0\fs28\b0 \uc1\u1071 ?\uc1\u1082 ?\uc1\u1080 ?\uc1\u1084 ?\uc1\u1080 ? \uc1\u1073 ?\uc1\u1091 ?\uc1\u1083 ?\uc1\u1080 ? \uc1\u1074 ?\uc1\u1080 ?\uc1\u1093 ?\uc1\u1110 ?\uc1\u1076 ?\uc1\u1085 ?\uc1\u1072 ? \uc1\u1090 ?\uc1\u1072 ? \uc1\u1094 ?\uc1\u1110 ?\uc1\u1083 ?\uc1\u1100 ?\uc1\u1086 ?\uc1\u1074 ?\uc1\u1072 ? \uc1\u1072 ?\uc1\u1076 ?\uc1\u1088 ?\uc1\u1077 ?\uc1\u1089 ?\uc1\u1080 ? \uc1\u1087 ?\uc1\u1072 ?\uc1\u1082 ?\uc1\u1077 ?\uc1\u1090 ?\uc1\u1110 ?\uc1\u1074 ? \uc1\u1110 ?\uc1\u1079 ? \uc1\u1079 ?\uc1\u1072 ?\uc1\u1087 ?\uc1\u1080 ?\uc1\u1090 ?\uc1\u1086 ?\uc1\u1084 ? \uc1\u1090 ?\uc1\u1072 ? \uc1\u1110 ?\uc1\u1079 ? \uc1\u1074 ?\uc1\u1110 ?\uc1\u1076 ?\uc1\u1087 ?\uc1\u1086 ?\uc1\u1074 ?\uc1\u1110 ?\uc1\u1076 ?\uc1\u1076 ?\uc1\u1102 ??\par\pard\plain\s1\nooverflow\nocwrap\lnbrkrule\li102\sl240\slmult1\sb193\tx2226\f0\fs28\b0 192.168.0.107\tab 128.119.245.12\par\pard\plain\s1\nooverflow\nocwrap\lnbrkrule\li102\sl240\slmult1\sb250\tx2226\f0\fs28\b0 128.119.245.12\tab 192.168.0.107\par\pard\plain\s4\ls1\ilvl0\nooverflow\nocwrap\lnbrkrule\li102\fi359\ri1795\sl424\slmult1\sb249\tx810\f0\fs28\b0 \uc1\u1071 ?\uc1\u1082 ?\uc1\u1080 ?\uc1\u1084 ? \uc1\u1073 ?\uc1\u1091 ?\uc1\u1074 ? \uc1\u1087 ?\uc1\u1077 ?\uc1\u1088 ?\uc1\u1096 ?\uc1\u1080 ?\uc1\u1081 ? \uc1\u1088 ?\uc1\u1103 ?\uc1\u1076 ?\uc1\u1086 ?\uc1\u1082 ? \uc1\u1079 ?\uc1\u1072 ?\uc1\u1087 ?\uc1\u1080 ?\uc1\u1090 ?\uc1\u1091 ? \uc1\u1085 ?\uc1\u1072 ? \uc1\u1088 ?\uc1\u1110 ?\uc1\u1074 ?\uc1\u1085 ?\uc1\u1110 ? \uc1\u1087 ?\uc1\u1088 ?\uc1\u1086 ?\uc1\u1090 ?\uc1\u1086 ?\uc1\u1082 ?\uc1\u1086 ?\uc1\u1083 ?\uc1\u1091 ? HTTP? GET /wireshark-labs/INTRO-wireshark-file1.html\expnd-1\expndtw-3  \f0\fs28\b0\i0\expnd0\expndtw0 HTTP/1.1\par\sect\sectd\sbkpage\margtsxn1040\pard\plain\s4\ls1\ilvl0\nooverflow\nocwrap\lnbrkrule\li102\fi359\ri1521\sl427\slmult1\sb69\tx810\f0\fs28\b0 \uc1\u1071 ?\uc1\u1082 ?\uc1\u1080 ?\uc1\u1084 ? \uc1\u1073 ?\uc1\u1091 ?\uc1\u1074 ? \uc1\u1087 ?\uc1\u1077 ?\uc1\u1088 ?\uc1\u1096 ?\uc1\u1080 ?\uc1\u1081 ? \uc1\u1088 ?\uc1\u1103 ?\uc1\u1076 ?\uc1\u1086 ?\uc1\u1082 ? \uc1\u1074 ?\uc1\u1110 ?\uc1\u1076 ?\uc1\u1087 ?\uc1\u1086 ?\uc1\u1074 ?\uc1\u1110 ?\uc1\u1076 ?\uc1\u1110 ? \uc1\u1085 ?\uc1\u1072 ? \uc1\u1088 ?\uc1\u1110 ?\uc1\u1074 ?\uc1\u1085 ?\uc1\u1110 ? \uc1\u1087 ?\uc1\u1088 ?\uc1\u1086 ?\uc1\u1090 ?\uc1\u1086 ?\uc1\u1082 ?\uc1\u1086 ?\uc1\u1083 ?\uc1\u1091 ?\expnd-6\expndtw-31  \f0\fs28\b0\i0\expnd0\expndtw0 HTTP? HTTP/1.1 304 Not\expnd0\expndtw-2  \f0\fs28\b0\i0\expnd0\expndtw0 Modified\par\pard\plain\s1\nooverflow\nocwrap\lnbrkrule\sl240\slmult1\f0\fs30\b0\i0\par\pard\plain\s1\nooverflow\nocwrap\lnbrkrule\li102\ri819\sl278\slmult1\sb219\f0\fs28\b0 \uc1\u1042 ?\uc1\u1080 ?\uc1\u1089 ?\uc1\u1085 ?\uc1\u1086 ?\uc1\u1074 ?\uc1\u1082 ?\uc1\u1080 ?: \uc1\u1042 ? \uc1\u1087 ?\uc1\u1088 ?\uc1\u1086 ?\uc1\u1094 ?\uc1\u1077 ?\uc1\u1089 ?\uc1\u1110 ? \uc1\u1074 ?\uc1\u1080 ?\uc1\u1082 ?\uc1\u1086 ?\uc1\u1085 ?\uc1\u1072 ?\uc1\u1085 ?\uc1\u1085 ?\uc1\u1103 ? \uc1\u1076 ?\uc1\u1072 ?\uc1\u1085 ?\uc1\u1086 ?\uc1\u1111 ? \uc1\u1083 ?\uc1\u1072 ?\uc1\u1073 ?\uc1\u1086 ?\uc1\u1088 ?\uc1\u1072 ?\uc1\u1090 ?\uc1\u1086 ?\uc1\u1088 ?\uc1\u1085 ?\uc1\u1086 ?\uc1\u1111 ? \uc1\u1088 ?\uc1\u1086 ?\uc1\u1073 ?\uc1\u1086 ?\uc1\u1090 ?\uc1\u1080 ? \uc1\u1103 ? \uc1\u1086 ?\uc1\u1074 ?\uc1\u1086 ?\uc1\u1083 ?\uc1\u1086 ?\uc1\u1076 ?\uc1\u1110 ?\uc1\u1083 ?\uc1\u1072 ? \uc1\u1084 ?\uc1\u1077 ?\uc1\u1090 ?\uc1\u1086 ?\uc1\u1076 ?\uc1\u1072 ?\uc1\u1084 ?\uc1\u1080 ? \uc1\u1088 ?\uc1\u1086 ?\uc1\u1073 ?\uc1\u1086 ?\uc1\u1090 ?\uc1\u1080 ? \uc1\u1074 ? \uc1\u1089 ?\uc1\u1077 ?\uc1\u1088 ?\uc1\u1077 ?\uc1\u1076 ?\uc1\u1086 ?\uc1\u1074 ?\uc1\u1080 ?\uc1\u1097 ?\uc1\u1110 ? \uc1\u1079 ?\uc1\u1072 ?\uc1\u1093 ?\uc1\u1086 ?\uc1\u1087 ?\uc1\u1083 ?\uc1\u1077 ?\uc1\u1085 ?\uc1\u1085 ?\uc1\u1103 ? \uc1\u1090 ?\uc1\u1072 ? \uc1\u1072 ?\uc1\u1085 ?\uc1\u1072 ?\uc1\u1083 ?\uc1\u1110 ?\uc1\u1079 ?\uc1\u1091 ? \uc1\u1087 ?\uc1\u1072 ?\uc1\u1082 ?\uc1\u1077 ?\uc1\u1090 ?\uc1\u1110 ?\uc1\u1074 ? Wireshark, \uc1\u1085 ?\uc1\u1077 ?\uc1\u1086 ?\uc1\u1073 ?\uc1\u1093 ?\uc1\u1110 ?\uc1\u1076 ?\uc1\u1085 ?\uc1\u1080 ?\uc1\u1084 ?\uc1\u1080 ? \uc1\u1076 ?\uc1\u1083 ?\uc1\u1103 ? \uc1\u1076 ?\uc1\u1086 ?\uc1\u1089 ?\uc1\u1083 ?\uc1\u1110 ?\uc1\u1076 ?\uc1\u1078 ?\uc1\u1077 ?\uc1\u1085 ?\uc1\u1085 ?\uc1\u1103 ? \uc1\u1084 ?\uc1\u1077 ?\uc1\u1088 ?\uc1\u1077 ?\uc1\u1078 ?\uc1\u1077 ?\uc1\u1074 ?\uc1\u1080 ?\uc1\u1093 ? \uc1\u1087 ?\uc1\u1088 ?\uc1\u1086 ?\uc1\u1090 ?\uc1\u1086 ?\uc1\u1082 ?\uc1\u1086 ?\uc1\u1083 ?\uc1\u1110 ?\uc1\u1074 ?.\par}