No.     Time           Source                Destination           Protocol Length Info
      1 0.000000       192.168.0.103         149.154.167.50        SSL      283    Continuation Data

Frame 1: 283 bytes on wire (2264 bits), 283 bytes captured (2264 bits) on interface en0, id 0
Ethernet II, Src: Apple_d6:45:86 (a4:d1:8c:d6:45:86), Dst: Tp-LinkT_55:94:64 (14:cc:20:55:94:64)
Internet Protocol Version 4, Src: 192.168.0.103, Dst: 149.154.167.50
Transmission Control Protocol, Src Port: 52429, Dst Port: 443, Seq: 1, Ack: 1, Len: 217
Transport Layer Security

No.     Time           Source                Destination           Protocol Length Info
      2 0.059257       149.154.167.50        192.168.0.103         TCP      70     443 → 52429 [PSH, ACK] Seq=1 Ack=218 Win=32768 Len=4 TSval=909501697 TSecr=2136814029 [TCP segment of a reassembled PDU]

Frame 2: 70 bytes on wire (560 bits), 70 bytes captured (560 bits) on interface en0, id 0
Ethernet II, Src: Tp-LinkT_55:94:64 (14:cc:20:55:94:64), Dst: Apple_d6:45:86 (a4:d1:8c:d6:45:86)
Internet Protocol Version 4, Src: 149.154.167.50, Dst: 192.168.0.103
Transmission Control Protocol, Src Port: 443, Dst Port: 52429, Seq: 1, Ack: 218, Len: 4

No.     Time           Source                Destination           Protocol Length Info
      3 0.059390       192.168.0.103         149.154.167.50        TCP      66     52429 → 443 [ACK] Seq=218 Ack=5 Win=2047 Len=0 TSval=2136814088 TSecr=909501697

Frame 3: 66 bytes on wire (528 bits), 66 bytes captured (528 bits) on interface en0, id 0
Ethernet II, Src: Apple_d6:45:86 (a4:d1:8c:d6:45:86), Dst: Tp-LinkT_55:94:64 (14:cc:20:55:94:64)
Internet Protocol Version 4, Src: 192.168.0.103, Dst: 149.154.167.50
Transmission Control Protocol, Src Port: 52429, Dst Port: 443, Seq: 218, Ack: 5, Len: 0

No.     Time           Source                Destination           Protocol Length Info
      4 0.073822       149.154.167.50        192.168.0.103         SSL      734    Continuation Data

Frame 4: 734 bytes on wire (5872 bits), 734 bytes captured (5872 bits) on interface en0, id 0
Ethernet II, Src: Tp-LinkT_55:94:64 (14:cc:20:55:94:64), Dst: Apple_d6:45:86 (a4:d1:8c:d6:45:86)
Internet Protocol Version 4, Src: 149.154.167.50, Dst: 192.168.0.103
Transmission Control Protocol, Src Port: 443, Dst Port: 52429, Seq: 5, Ack: 218, Len: 668
[2 Reassembled TCP Segments (672 bytes): #2(4), #4(668)]
Transport Layer Security

No.     Time           Source                Destination           Protocol Length Info
      5 0.073950       192.168.0.103         149.154.167.50        TCP      66     52429 → 443 [ACK] Seq=218 Ack=673 Win=2037 Len=0 TSval=2136814102 TSecr=909501711

Frame 5: 66 bytes on wire (528 bits), 66 bytes captured (528 bits) on interface en0, id 0
Ethernet II, Src: Apple_d6:45:86 (a4:d1:8c:d6:45:86), Dst: Tp-LinkT_55:94:64 (14:cc:20:55:94:64)
Internet Protocol Version 4, Src: 192.168.0.103, Dst: 149.154.167.50
Transmission Control Protocol, Src Port: 52429, Dst Port: 443, Seq: 218, Ack: 673, Len: 0

No.     Time           Source                Destination           Protocol Length Info
      6 0.075929       192.168.0.103         149.154.167.50        SSL      235    Continuation Data

Frame 6: 235 bytes on wire (1880 bits), 235 bytes captured (1880 bits) on interface en0, id 0
Ethernet II, Src: Apple_d6:45:86 (a4:d1:8c:d6:45:86), Dst: Tp-LinkT_55:94:64 (14:cc:20:55:94:64)
Internet Protocol Version 4, Src: 192.168.0.103, Dst: 149.154.167.50
Transmission Control Protocol, Src Port: 52429, Dst Port: 443, Seq: 218, Ack: 673, Len: 169
Transport Layer Security

No.     Time           Source                Destination           Protocol Length Info
      7 0.134696       149.154.167.50        192.168.0.103         TCP      70     443 → 52429 [PSH, ACK] Seq=673 Ack=387 Win=32768 Len=4 TSval=909501771 TSecr=2136814103 [TCP segment of a reassembled PDU]

Frame 7: 70 bytes on wire (560 bits), 70 bytes captured (560 bits) on interface en0, id 0
Ethernet II, Src: Tp-LinkT_55:94:64 (14:cc:20:55:94:64), Dst: Apple_d6:45:86 (a4:d1:8c:d6:45:86)
Internet Protocol Version 4, Src: 149.154.167.50, Dst: 192.168.0.103
Transmission Control Protocol, Src Port: 443, Dst Port: 52429, Seq: 673, Ack: 387, Len: 4

No.     Time           Source                Destination           Protocol Length Info
      8 0.134825       192.168.0.103         149.154.167.50        TCP      66     52429 → 443 [ACK] Seq=387 Ack=677 Win=2047 Len=0 TSval=2136814161 TSecr=909501771

Frame 8: 66 bytes on wire (528 bits), 66 bytes captured (528 bits) on interface en0, id 0
Ethernet II, Src: Apple_d6:45:86 (a4:d1:8c:d6:45:86), Dst: Tp-LinkT_55:94:64 (14:cc:20:55:94:64)
Internet Protocol Version 4, Src: 192.168.0.103, Dst: 149.154.167.50
Transmission Control Protocol, Src Port: 52429, Dst Port: 443, Seq: 387, Ack: 677, Len: 0

No.     Time           Source                Destination           Protocol Length Info
      9 0.153472       149.154.167.50        192.168.0.103         SSL      862    Continuation Data

Frame 9: 862 bytes on wire (6896 bits), 862 bytes captured (6896 bits) on interface en0, id 0
Ethernet II, Src: Tp-LinkT_55:94:64 (14:cc:20:55:94:64), Dst: Apple_d6:45:86 (a4:d1:8c:d6:45:86)
Internet Protocol Version 4, Src: 149.154.167.50, Dst: 192.168.0.103
Transmission Control Protocol, Src Port: 443, Dst Port: 52429, Seq: 677, Ack: 387, Len: 796
[2 Reassembled TCP Segments (800 bytes): #7(4), #9(796)]
Transport Layer Security

No.     Time           Source                Destination           Protocol Length Info
     10 0.153597       192.168.0.103         149.154.167.50        TCP      66     52429 → 443 [ACK] Seq=387 Ack=1473 Win=2035 Len=0 TSval=2136814179 TSecr=909501788

Frame 10: 66 bytes on wire (528 bits), 66 bytes captured (528 bits) on interface en0, id 0
Ethernet II, Src: Apple_d6:45:86 (a4:d1:8c:d6:45:86), Dst: Tp-LinkT_55:94:64 (14:cc:20:55:94:64)
Internet Protocol Version 4, Src: 192.168.0.103, Dst: 149.154.167.50
Transmission Control Protocol, Src Port: 52429, Dst Port: 443, Seq: 387, Ack: 1473, Len: 0

No.     Time           Source                Destination           Protocol Length Info
     11 0.156122       192.168.0.103         149.154.167.50        SSL      267    Continuation Data

Frame 11: 267 bytes on wire (2136 bits), 267 bytes captured (2136 bits) on interface en0, id 0
Ethernet II, Src: Apple_d6:45:86 (a4:d1:8c:d6:45:86), Dst: Tp-LinkT_55:94:64 (14:cc:20:55:94:64)
Internet Protocol Version 4, Src: 192.168.0.103, Dst: 149.154.167.50
Transmission Control Protocol, Src Port: 52429, Dst Port: 443, Seq: 387, Ack: 1473, Len: 201
Transport Layer Security

No.     Time           Source                Destination           Protocol Length Info
     12 0.214358       149.154.167.50        192.168.0.103         TCP      70     443 → 52429 [PSH, ACK] Seq=1473 Ack=588 Win=32768 Len=4 TSval=909501851 TSecr=2136814181 [TCP segment of a reassembled PDU]

Frame 12: 70 bytes on wire (560 bits), 70 bytes captured (560 bits) on interface en0, id 0
Ethernet II, Src: Tp-LinkT_55:94:64 (14:cc:20:55:94:64), Dst: Apple_d6:45:86 (a4:d1:8c:d6:45:86)
Internet Protocol Version 4, Src: 149.154.167.50, Dst: 192.168.0.103
Transmission Control Protocol, Src Port: 443, Dst Port: 52429, Seq: 1473, Ack: 588, Len: 4

No.     Time           Source                Destination           Protocol Length Info
     13 0.214480       192.168.0.103         149.154.167.50        TCP      66     52429 → 443 [ACK] Seq=588 Ack=1477 Win=2047 Len=0 TSval=2136814239 TSecr=909501851

Frame 13: 66 bytes on wire (528 bits), 66 bytes captured (528 bits) on interface en0, id 0
Ethernet II, Src: Apple_d6:45:86 (a4:d1:8c:d6:45:86), Dst: Tp-LinkT_55:94:64 (14:cc:20:55:94:64)
Internet Protocol Version 4, Src: 192.168.0.103, Dst: 149.154.167.50
Transmission Control Protocol, Src Port: 52429, Dst Port: 443, Seq: 588, Ack: 1477, Len: 0

No.     Time           Source                Destination           Protocol Length Info
     14 0.282239       149.154.167.50        192.168.0.103         SSL      734    Continuation Data

Frame 14: 734 bytes on wire (5872 bits), 734 bytes captured (5872 bits) on interface en0, id 0
Ethernet II, Src: Tp-LinkT_55:94:64 (14:cc:20:55:94:64), Dst: Apple_d6:45:86 (a4:d1:8c:d6:45:86)
Internet Protocol Version 4, Src: 149.154.167.50, Dst: 192.168.0.103
Transmission Control Protocol, Src Port: 443, Dst Port: 52429, Seq: 1477, Ack: 588, Len: 668
[2 Reassembled TCP Segments (672 bytes): #12(4), #14(668)]
Transport Layer Security

No.     Time           Source                Destination           Protocol Length Info
     15 0.282314       192.168.0.103         149.154.167.50        TCP      66     52429 → 443 [ACK] Seq=588 Ack=2145 Win=2037 Len=0 TSval=2136814305 TSecr=909501918

Frame 15: 66 bytes on wire (528 bits), 66 bytes captured (528 bits) on interface en0, id 0
Ethernet II, Src: Apple_d6:45:86 (a4:d1:8c:d6:45:86), Dst: Tp-LinkT_55:94:64 (14:cc:20:55:94:64)
Internet Protocol Version 4, Src: 192.168.0.103, Dst: 149.154.167.50
Transmission Control Protocol, Src Port: 52429, Dst Port: 443, Seq: 588, Ack: 2145, Len: 0

No.     Time           Source                Destination           Protocol Length Info
     16 0.284269       192.168.0.103         149.154.167.50        SSL      235    Continuation Data

Frame 16: 235 bytes on wire (1880 bits), 235 bytes captured (1880 bits) on interface en0, id 0
Ethernet II, Src: Apple_d6:45:86 (a4:d1:8c:d6:45:86), Dst: Tp-LinkT_55:94:64 (14:cc:20:55:94:64)
Internet Protocol Version 4, Src: 192.168.0.103, Dst: 149.154.167.50
Transmission Control Protocol, Src Port: 52429, Dst Port: 443, Seq: 588, Ack: 2145, Len: 169
Transport Layer Security

No.     Time           Source                Destination           Protocol Length Info
     17 0.346161       149.154.167.50        192.168.0.103         TCP      70     443 → 52429 [PSH, ACK] Seq=2145 Ack=757 Win=32768 Len=4 TSval=909501985 TSecr=2136814306 [TCP segment of a reassembled PDU]

Frame 17: 70 bytes on wire (560 bits), 70 bytes captured (560 bits) on interface en0, id 0
Ethernet II, Src: Tp-LinkT_55:94:64 (14:cc:20:55:94:64), Dst: Apple_d6:45:86 (a4:d1:8c:d6:45:86)
Internet Protocol Version 4, Src: 149.154.167.50, Dst: 192.168.0.103
Transmission Control Protocol, Src Port: 443, Dst Port: 52429, Seq: 2145, Ack: 757, Len: 4

No.     Time           Source                Destination           Protocol Length Info
     18 0.346266       192.168.0.103         149.154.167.50        TCP      66     52429 → 443 [ACK] Seq=757 Ack=2149 Win=2047 Len=0 TSval=2136814368 TSecr=909501985

Frame 18: 66 bytes on wire (528 bits), 66 bytes captured (528 bits) on interface en0, id 0
Ethernet II, Src: Apple_d6:45:86 (a4:d1:8c:d6:45:86), Dst: Tp-LinkT_55:94:64 (14:cc:20:55:94:64)
Internet Protocol Version 4, Src: 192.168.0.103, Dst: 149.154.167.50
Transmission Control Protocol, Src Port: 52429, Dst Port: 443, Seq: 757, Ack: 2149, Len: 0

No.     Time           Source                Destination           Protocol Length Info
     19 0.399222       149.154.167.50        192.168.0.103         SSL      862    Continuation Data

Frame 19: 862 bytes on wire (6896 bits), 862 bytes captured (6896 bits) on interface en0, id 0
Ethernet II, Src: Tp-LinkT_55:94:64 (14:cc:20:55:94:64), Dst: Apple_d6:45:86 (a4:d1:8c:d6:45:86)
Internet Protocol Version 4, Src: 149.154.167.50, Dst: 192.168.0.103
Transmission Control Protocol, Src Port: 443, Dst Port: 52429, Seq: 2149, Ack: 757, Len: 796
[2 Reassembled TCP Segments (800 bytes): #17(4), #19(796)]
Transport Layer Security

No.     Time           Source                Destination           Protocol Length Info
     20 0.399345       192.168.0.103         149.154.167.50        TCP      66     52429 → 443 [ACK] Seq=757 Ack=2945 Win=2035 Len=0 TSval=2136814420 TSecr=909502037

Frame 20: 66 bytes on wire (528 bits), 66 bytes captured (528 bits) on interface en0, id 0
Ethernet II, Src: Apple_d6:45:86 (a4:d1:8c:d6:45:86), Dst: Tp-LinkT_55:94:64 (14:cc:20:55:94:64)
Internet Protocol Version 4, Src: 192.168.0.103, Dst: 149.154.167.50
Transmission Control Protocol, Src Port: 52429, Dst Port: 443, Seq: 757, Ack: 2945, Len: 0

No.     Time           Source                Destination           Protocol Length Info
     21 0.402164       192.168.0.103         149.154.167.50        SSL      251    Continuation Data

Frame 21: 251 bytes on wire (2008 bits), 251 bytes captured (2008 bits) on interface en0, id 0
Ethernet II, Src: Apple_d6:45:86 (a4:d1:8c:d6:45:86), Dst: Tp-LinkT_55:94:64 (14:cc:20:55:94:64)
Internet Protocol Version 4, Src: 192.168.0.103, Dst: 149.154.167.50
Transmission Control Protocol, Src Port: 52429, Dst Port: 443, Seq: 757, Ack: 2945, Len: 185
Transport Layer Security

No.     Time           Source                Destination           Protocol Length Info
     22 0.463868       149.154.167.50        192.168.0.103         TCP      70     443 → 52429 [PSH, ACK] Seq=2945 Ack=942 Win=32768 Len=4 TSval=909502103 TSecr=2136814422 [TCP segment of a reassembled PDU]

Frame 22: 70 bytes on wire (560 bits), 70 bytes captured (560 bits) on interface en0, id 0
Ethernet II, Src: Tp-LinkT_55:94:64 (14:cc:20:55:94:64), Dst: Apple_d6:45:86 (a4:d1:8c:d6:45:86)
Internet Protocol Version 4, Src: 149.154.167.50, Dst: 192.168.0.103
Transmission Control Protocol, Src Port: 443, Dst Port: 52429, Seq: 2945, Ack: 942, Len: 4

No.     Time           Source                Destination           Protocol Length Info
     23 0.463951       192.168.0.103         149.154.167.50        TCP      66     52429 → 443 [ACK] Seq=942 Ack=2949 Win=2047 Len=0 TSval=2136814483 TSecr=909502103

Frame 23: 66 bytes on wire (528 bits), 66 bytes captured (528 bits) on interface en0, id 0
Ethernet II, Src: Apple_d6:45:86 (a4:d1:8c:d6:45:86), Dst: Tp-LinkT_55:94:64 (14:cc:20:55:94:64)
Internet Protocol Version 4, Src: 192.168.0.103, Dst: 149.154.167.50
Transmission Control Protocol, Src Port: 52429, Dst Port: 443, Seq: 942, Ack: 2949, Len: 0

No.     Time           Source                Destination           Protocol Length Info
     24 0.491290       149.154.167.50        192.168.0.103         SSL      734    Continuation Data

Frame 24: 734 bytes on wire (5872 bits), 734 bytes captured (5872 bits) on interface en0, id 0
Ethernet II, Src: Tp-LinkT_55:94:64 (14:cc:20:55:94:64), Dst: Apple_d6:45:86 (a4:d1:8c:d6:45:86)
Internet Protocol Version 4, Src: 149.154.167.50, Dst: 192.168.0.103
Transmission Control Protocol, Src Port: 443, Dst Port: 52429, Seq: 2949, Ack: 942, Len: 668
[2 Reassembled TCP Segments (672 bytes): #22(4), #24(668)]
Transport Layer Security

No.     Time           Source                Destination           Protocol Length Info
     25 0.491361       192.168.0.103         149.154.167.50        TCP      66     52429 → 443 [ACK] Seq=942 Ack=3617 Win=2037 Len=0 TSval=2136814509 TSecr=909502128

Frame 25: 66 bytes on wire (528 bits), 66 bytes captured (528 bits) on interface en0, id 0
Ethernet II, Src: Apple_d6:45:86 (a4:d1:8c:d6:45:86), Dst: Tp-LinkT_55:94:64 (14:cc:20:55:94:64)
Internet Protocol Version 4, Src: 192.168.0.103, Dst: 149.154.167.50
Transmission Control Protocol, Src Port: 52429, Dst Port: 443, Seq: 942, Ack: 3617, Len: 0

No.     Time           Source                Destination           Protocol Length Info
     26 0.492469       192.168.0.103         149.154.167.50        SSL      267    Continuation Data

Frame 26: 267 bytes on wire (2136 bits), 267 bytes captured (2136 bits) on interface en0, id 0
Ethernet II, Src: Apple_d6:45:86 (a4:d1:8c:d6:45:86), Dst: Tp-LinkT_55:94:64 (14:cc:20:55:94:64)
Internet Protocol Version 4, Src: 192.168.0.103, Dst: 149.154.167.50
Transmission Control Protocol, Src Port: 52429, Dst Port: 443, Seq: 942, Ack: 3617, Len: 201
Transport Layer Security

No.     Time           Source                Destination           Protocol Length Info
     27 0.551422       149.154.167.50        192.168.0.103         TCP      70     443 → 52429 [PSH, ACK] Seq=3617 Ack=1143 Win=32768 Len=4 TSval=909502189 TSecr=2136814510 [TCP segment of a reassembled PDU]

Frame 27: 70 bytes on wire (560 bits), 70 bytes captured (560 bits) on interface en0, id 0
Ethernet II, Src: Tp-LinkT_55:94:64 (14:cc:20:55:94:64), Dst: Apple_d6:45:86 (a4:d1:8c:d6:45:86)
Internet Protocol Version 4, Src: 149.154.167.50, Dst: 192.168.0.103
Transmission Control Protocol, Src Port: 443, Dst Port: 52429, Seq: 3617, Ack: 1143, Len: 4

No.     Time           Source                Destination           Protocol Length Info
     28 0.551617       192.168.0.103         149.154.167.50        TCP      66     52429 → 443 [ACK] Seq=1143 Ack=3621 Win=2047 Len=0 TSval=2136814569 TSecr=909502189

Frame 28: 66 bytes on wire (528 bits), 66 bytes captured (528 bits) on interface en0, id 0
Ethernet II, Src: Apple_d6:45:86 (a4:d1:8c:d6:45:86), Dst: Tp-LinkT_55:94:64 (14:cc:20:55:94:64)
Internet Protocol Version 4, Src: 192.168.0.103, Dst: 149.154.167.50
Transmission Control Protocol, Src Port: 52429, Dst Port: 443, Seq: 1143, Ack: 3621, Len: 0

No.     Time           Source                Destination           Protocol Length Info
     29 0.609569       149.154.167.50        192.168.0.103         SSL      862    Continuation Data

Frame 29: 862 bytes on wire (6896 bits), 862 bytes captured (6896 bits) on interface en0, id 0
Ethernet II, Src: Tp-LinkT_55:94:64 (14:cc:20:55:94:64), Dst: Apple_d6:45:86 (a4:d1:8c:d6:45:86)
Internet Protocol Version 4, Src: 149.154.167.50, Dst: 192.168.0.103
Transmission Control Protocol, Src Port: 443, Dst Port: 52429, Seq: 3621, Ack: 1143, Len: 796
[2 Reassembled TCP Segments (800 bytes): #27(4), #29(796)]
Transport Layer Security

No.     Time           Source                Destination           Protocol Length Info
     30 0.609701       192.168.0.103         149.154.167.50        TCP      66     52429 → 443 [ACK] Seq=1143 Ack=4417 Win=2035 Len=0 TSval=2136814626 TSecr=909502241

Frame 30: 66 bytes on wire (528 bits), 66 bytes captured (528 bits) on interface en0, id 0
Ethernet II, Src: Apple_d6:45:86 (a4:d1:8c:d6:45:86), Dst: Tp-LinkT_55:94:64 (14:cc:20:55:94:64)
Internet Protocol Version 4, Src: 192.168.0.103, Dst: 149.154.167.50
Transmission Control Protocol, Src Port: 52429, Dst Port: 443, Seq: 1143, Ack: 4417, Len: 0

No.     Time           Source                Destination           Protocol Length Info
     31 0.612440       192.168.0.103         149.154.167.50        SSL      235    Continuation Data

Frame 31: 235 bytes on wire (1880 bits), 235 bytes captured (1880 bits) on interface en0, id 0
Ethernet II, Src: Apple_d6:45:86 (a4:d1:8c:d6:45:86), Dst: Tp-LinkT_55:94:64 (14:cc:20:55:94:64)
Internet Protocol Version 4, Src: 192.168.0.103, Dst: 149.154.167.50
Transmission Control Protocol, Src Port: 52429, Dst Port: 443, Seq: 1143, Ack: 4417, Len: 169
Transport Layer Security

No.     Time           Source                Destination           Protocol Length Info
     32 0.711709       149.154.167.50        192.168.0.103         TCP      70     443 → 52429 [PSH, ACK] Seq=4417 Ack=1312 Win=32768 Len=4 TSval=909502345 TSecr=2136814628 [TCP segment of a reassembled PDU]

Frame 32: 70 bytes on wire (560 bits), 70 bytes captured (560 bits) on interface en0, id 0
Ethernet II, Src: Tp-LinkT_55:94:64 (14:cc:20:55:94:64), Dst: Apple_d6:45:86 (a4:d1:8c:d6:45:86)
Internet Protocol Version 4, Src: 149.154.167.50, Dst: 192.168.0.103
Transmission Control Protocol, Src Port: 443, Dst Port: 52429, Seq: 4417, Ack: 1312, Len: 4

No.     Time           Source                Destination           Protocol Length Info
     33 0.711895       192.168.0.103         149.154.167.50        TCP      66     52429 → 443 [ACK] Seq=1312 Ack=4421 Win=2047 Len=0 TSval=2136814726 TSecr=909502345

Frame 33: 66 bytes on wire (528 bits), 66 bytes captured (528 bits) on interface en0, id 0
Ethernet II, Src: Apple_d6:45:86 (a4:d1:8c:d6:45:86), Dst: Tp-LinkT_55:94:64 (14:cc:20:55:94:64)
Internet Protocol Version 4, Src: 192.168.0.103, Dst: 149.154.167.50
Transmission Control Protocol, Src Port: 52429, Dst Port: 443, Seq: 1312, Ack: 4421, Len: 0

No.     Time           Source                Destination           Protocol Length Info
     34 0.755045       149.154.167.50        192.168.0.103         SSL      734    Continuation Data

Frame 34: 734 bytes on wire (5872 bits), 734 bytes captured (5872 bits) on interface en0, id 0
Ethernet II, Src: Tp-LinkT_55:94:64 (14:cc:20:55:94:64), Dst: Apple_d6:45:86 (a4:d1:8c:d6:45:86)
Internet Protocol Version 4, Src: 149.154.167.50, Dst: 192.168.0.103
Transmission Control Protocol, Src Port: 443, Dst Port: 52429, Seq: 4421, Ack: 1312, Len: 668
[2 Reassembled TCP Segments (672 bytes): #32(4), #34(668)]
Transport Layer Security

No.     Time           Source                Destination           Protocol Length Info
     35 0.755130       192.168.0.103         149.154.167.50        TCP      66     52429 → 443 [ACK] Seq=1312 Ack=5089 Win=2037 Len=0 TSval=2136814769 TSecr=909502377

Frame 35: 66 bytes on wire (528 bits), 66 bytes captured (528 bits) on interface en0, id 0
Ethernet II, Src: Apple_d6:45:86 (a4:d1:8c:d6:45:86), Dst: Tp-LinkT_55:94:64 (14:cc:20:55:94:64)
Internet Protocol Version 4, Src: 192.168.0.103, Dst: 149.154.167.50
Transmission Control Protocol, Src Port: 52429, Dst Port: 443, Seq: 1312, Ack: 5089, Len: 0

No.     Time           Source                Destination           Protocol Length Info
     36 0.756616       192.168.0.103         149.154.167.50        SSL      251    Continuation Data

Frame 36: 251 bytes on wire (2008 bits), 251 bytes captured (2008 bits) on interface en0, id 0
Ethernet II, Src: Apple_d6:45:86 (a4:d1:8c:d6:45:86), Dst: Tp-LinkT_55:94:64 (14:cc:20:55:94:64)
Internet Protocol Version 4, Src: 192.168.0.103, Dst: 149.154.167.50
Transmission Control Protocol, Src Port: 52429, Dst Port: 443, Seq: 1312, Ack: 5089, Len: 185
Transport Layer Security

No.     Time           Source                Destination           Protocol Length Info
     37 0.833911       149.154.167.50        192.168.0.103         TCP      70     443 → 52429 [PSH, ACK] Seq=5089 Ack=1497 Win=32768 Len=4 TSval=909502464 TSecr=2136814770 [TCP segment of a reassembled PDU]

Frame 37: 70 bytes on wire (560 bits), 70 bytes captured (560 bits) on interface en0, id 0
Ethernet II, Src: Tp-LinkT_55:94:64 (14:cc:20:55:94:64), Dst: Apple_d6:45:86 (a4:d1:8c:d6:45:86)
Internet Protocol Version 4, Src: 149.154.167.50, Dst: 192.168.0.103
Transmission Control Protocol, Src Port: 443, Dst Port: 52429, Seq: 5089, Ack: 1497, Len: 4

No.     Time           Source                Destination           Protocol Length Info
     38 0.834012       192.168.0.103         149.154.167.50        TCP      66     52429 → 443 [ACK] Seq=1497 Ack=5093 Win=2047 Len=0 TSval=2136814847 TSecr=909502464

Frame 38: 66 bytes on wire (528 bits), 66 bytes captured (528 bits) on interface en0, id 0
Ethernet II, Src: Apple_d6:45:86 (a4:d1:8c:d6:45:86), Dst: Tp-LinkT_55:94:64 (14:cc:20:55:94:64)
Internet Protocol Version 4, Src: 192.168.0.103, Dst: 149.154.167.50
Transmission Control Protocol, Src Port: 52429, Dst Port: 443, Seq: 1497, Ack: 5093, Len: 0

No.     Time           Source                Destination           Protocol Length Info
     39 0.841041       149.154.167.50        192.168.0.103         SSL      862    Continuation Data

Frame 39: 862 bytes on wire (6896 bits), 862 bytes captured (6896 bits) on interface en0, id 0
Ethernet II, Src: Tp-LinkT_55:94:64 (14:cc:20:55:94:64), Dst: Apple_d6:45:86 (a4:d1:8c:d6:45:86)
Internet Protocol Version 4, Src: 149.154.167.50, Dst: 192.168.0.103
Transmission Control Protocol, Src Port: 443, Dst Port: 52429, Seq: 5093, Ack: 1497, Len: 796
[2 Reassembled TCP Segments (800 bytes): #37(4), #39(796)]
Transport Layer Security

No.     Time           Source                Destination           Protocol Length Info
     40 0.841136       192.168.0.103         149.154.167.50        TCP      66     52429 → 443 [ACK] Seq=1497 Ack=5889 Win=2035 Len=0 TSval=2136814854 TSecr=909502480

Frame 40: 66 bytes on wire (528 bits), 66 bytes captured (528 bits) on interface en0, id 0
Ethernet II, Src: Apple_d6:45:86 (a4:d1:8c:d6:45:86), Dst: Tp-LinkT_55:94:64 (14:cc:20:55:94:64)
Internet Protocol Version 4, Src: 192.168.0.103, Dst: 149.154.167.50
Transmission Control Protocol, Src Port: 52429, Dst Port: 443, Seq: 1497, Ack: 5889, Len: 0

No.     Time           Source                Destination           Protocol Length Info
     41 0.843410       192.168.0.103         149.154.167.50        SSL      235    Continuation Data

Frame 41: 235 bytes on wire (1880 bits), 235 bytes captured (1880 bits) on interface en0, id 0
Ethernet II, Src: Apple_d6:45:86 (a4:d1:8c:d6:45:86), Dst: Tp-LinkT_55:94:64 (14:cc:20:55:94:64)
Internet Protocol Version 4, Src: 192.168.0.103, Dst: 149.154.167.50
Transmission Control Protocol, Src Port: 52429, Dst Port: 443, Seq: 1497, Ack: 5889, Len: 169
Transport Layer Security

No.     Time           Source                Destination           Protocol Length Info
     42 0.936565       149.154.167.50        192.168.0.103         TCP      70     443 → 52429 [PSH, ACK] Seq=5889 Ack=1666 Win=32768 Len=4 TSval=909502555 TSecr=2136814856 [TCP segment of a reassembled PDU]

Frame 42: 70 bytes on wire (560 bits), 70 bytes captured (560 bits) on interface en0, id 0
Ethernet II, Src: Tp-LinkT_55:94:64 (14:cc:20:55:94:64), Dst: Apple_d6:45:86 (a4:d1:8c:d6:45:86)
Internet Protocol Version 4, Src: 149.154.167.50, Dst: 192.168.0.103
Transmission Control Protocol, Src Port: 443, Dst Port: 52429, Seq: 5889, Ack: 1666, Len: 4

No.     Time           Source                Destination           Protocol Length Info
     43 0.936689       192.168.0.103         149.154.167.50        TCP      66     52429 → 443 [ACK] Seq=1666 Ack=5893 Win=2047 Len=0 TSval=2136814948 TSecr=909502555

Frame 43: 66 bytes on wire (528 bits), 66 bytes captured (528 bits) on interface en0, id 0
Ethernet II, Src: Apple_d6:45:86 (a4:d1:8c:d6:45:86), Dst: Tp-LinkT_55:94:64 (14:cc:20:55:94:64)
Internet Protocol Version 4, Src: 192.168.0.103, Dst: 149.154.167.50
Transmission Control Protocol, Src Port: 52429, Dst Port: 443, Seq: 1666, Ack: 5893, Len: 0

No.     Time           Source                Destination           Protocol Length Info
     44 0.944247       149.154.167.50        192.168.0.103         SSL      734    Continuation Data

Frame 44: 734 bytes on wire (5872 bits), 734 bytes captured (5872 bits) on interface en0, id 0
Ethernet II, Src: Tp-LinkT_55:94:64 (14:cc:20:55:94:64), Dst: Apple_d6:45:86 (a4:d1:8c:d6:45:86)
Internet Protocol Version 4, Src: 149.154.167.50, Dst: 192.168.0.103
Transmission Control Protocol, Src Port: 443, Dst Port: 52429, Seq: 5893, Ack: 1666, Len: 668
[2 Reassembled TCP Segments (672 bytes): #42(4), #44(668)]
Transport Layer Security

No.     Time           Source                Destination           Protocol Length Info
     45 0.944363       192.168.0.103         149.154.167.50        TCP      66     52429 → 443 [ACK] Seq=1666 Ack=6561 Win=2037 Len=0 TSval=2136814955 TSecr=909502578

Frame 45: 66 bytes on wire (528 bits), 66 bytes captured (528 bits) on interface en0, id 0
Ethernet II, Src: Apple_d6:45:86 (a4:d1:8c:d6:45:86), Dst: Tp-LinkT_55:94:64 (14:cc:20:55:94:64)
Internet Protocol Version 4, Src: 192.168.0.103, Dst: 149.154.167.50
Transmission Control Protocol, Src Port: 52429, Dst Port: 443, Seq: 1666, Ack: 6561, Len: 0

No.     Time           Source                Destination           Protocol Length Info
     46 0.946180       192.168.0.103         149.154.167.50        SSL      235    Continuation Data

Frame 46: 235 bytes on wire (1880 bits), 235 bytes captured (1880 bits) on interface en0, id 0
Ethernet II, Src: Apple_d6:45:86 (a4:d1:8c:d6:45:86), Dst: Tp-LinkT_55:94:64 (14:cc:20:55:94:64)
Internet Protocol Version 4, Src: 192.168.0.103, Dst: 149.154.167.50
Transmission Control Protocol, Src Port: 52429, Dst Port: 443, Seq: 1666, Ack: 6561, Len: 169
Transport Layer Security

No.     Time           Source                Destination           Protocol Length Info
     47 1.120125       149.154.167.50        192.168.0.103         TCP      70     443 → 52429 [PSH, ACK] Seq=6561 Ack=1835 Win=32768 Len=4 TSval=909502756 TSecr=2136814956 [TCP segment of a reassembled PDU]

Frame 47: 70 bytes on wire (560 bits), 70 bytes captured (560 bits) on interface en0, id 0
Ethernet II, Src: Tp-LinkT_55:94:64 (14:cc:20:55:94:64), Dst: Apple_d6:45:86 (a4:d1:8c:d6:45:86)
Internet Protocol Version 4, Src: 149.154.167.50, Dst: 192.168.0.103
Transmission Control Protocol, Src Port: 443, Dst Port: 52429, Seq: 6561, Ack: 1835, Len: 4

No.     Time           Source                Destination           Protocol Length Info
     48 1.120259       192.168.0.103         149.154.167.50        TCP      66     52429 → 443 [ACK] Seq=1835 Ack=6565 Win=2047 Len=0 TSval=2136815129 TSecr=909502756

Frame 48: 66 bytes on wire (528 bits), 66 bytes captured (528 bits) on interface en0, id 0
Ethernet II, Src: Apple_d6:45:86 (a4:d1:8c:d6:45:86), Dst: Tp-LinkT_55:94:64 (14:cc:20:55:94:64)
Internet Protocol Version 4, Src: 192.168.0.103, Dst: 149.154.167.50
Transmission Control Protocol, Src Port: 52429, Dst Port: 443, Seq: 1835, Ack: 6565, Len: 0

No.     Time           Source                Destination           Protocol Length Info
     49 1.141500       149.154.167.50        192.168.0.103         SSL      862    Continuation Data

Frame 49: 862 bytes on wire (6896 bits), 862 bytes captured (6896 bits) on interface en0, id 0
Ethernet II, Src: Tp-LinkT_55:94:64 (14:cc:20:55:94:64), Dst: Apple_d6:45:86 (a4:d1:8c:d6:45:86)
Internet Protocol Version 4, Src: 149.154.167.50, Dst: 192.168.0.103
Transmission Control Protocol, Src Port: 443, Dst Port: 52429, Seq: 6565, Ack: 1835, Len: 796
[2 Reassembled TCP Segments (800 bytes): #47(4), #49(796)]
Transport Layer Security

No.     Time           Source                Destination           Protocol Length Info
     50 1.141626       192.168.0.103         149.154.167.50        TCP      66     52429 → 443 [ACK] Seq=1835 Ack=7361 Win=2035 Len=0 TSval=2136815150 TSecr=909502774

Frame 50: 66 bytes on wire (528 bits), 66 bytes captured (528 bits) on interface en0, id 0
Ethernet II, Src: Apple_d6:45:86 (a4:d1:8c:d6:45:86), Dst: Tp-LinkT_55:94:64 (14:cc:20:55:94:64)
Internet Protocol Version 4, Src: 192.168.0.103, Dst: 149.154.167.50
Transmission Control Protocol, Src Port: 52429, Dst Port: 443, Seq: 1835, Ack: 7361, Len: 0

No.     Time           Source                Destination           Protocol Length Info
     51 1.144244       192.168.0.103         149.154.167.50        SSL      267    Continuation Data

Frame 51: 267 bytes on wire (2136 bits), 267 bytes captured (2136 bits) on interface en0, id 0
Ethernet II, Src: Apple_d6:45:86 (a4:d1:8c:d6:45:86), Dst: Tp-LinkT_55:94:64 (14:cc:20:55:94:64)
Internet Protocol Version 4, Src: 192.168.0.103, Dst: 149.154.167.50
Transmission Control Protocol, Src Port: 52429, Dst Port: 443, Seq: 1835, Ack: 7361, Len: 201
Transport Layer Security

No.     Time           Source                Destination           Protocol Length Info
     52 1.223839       149.154.167.50        192.168.0.103         TCP      70     443 → 52429 [PSH, ACK] Seq=7361 Ack=2036 Win=32768 Len=4 TSval=909502850 TSecr=2136815151 [TCP segment of a reassembled PDU]

Frame 52: 70 bytes on wire (560 bits), 70 bytes captured (560 bits) on interface en0, id 0
Ethernet II, Src: Tp-LinkT_55:94:64 (14:cc:20:55:94:64), Dst: Apple_d6:45:86 (a4:d1:8c:d6:45:86)
Internet Protocol Version 4, Src: 149.154.167.50, Dst: 192.168.0.103
Transmission Control Protocol, Src Port: 443, Dst Port: 52429, Seq: 7361, Ack: 2036, Len: 4

No.     Time           Source                Destination           Protocol Length Info
     53 1.223968       192.168.0.103         149.154.167.50        TCP      66     52429 → 443 [ACK] Seq=2036 Ack=7365 Win=2047 Len=0 TSval=2136815231 TSecr=909502850

Frame 53: 66 bytes on wire (528 bits), 66 bytes captured (528 bits) on interface en0, id 0
Ethernet II, Src: Apple_d6:45:86 (a4:d1:8c:d6:45:86), Dst: Tp-LinkT_55:94:64 (14:cc:20:55:94:64)
Internet Protocol Version 4, Src: 192.168.0.103, Dst: 149.154.167.50
Transmission Control Protocol, Src Port: 52429, Dst Port: 443, Seq: 2036, Ack: 7365, Len: 0

No.     Time           Source                Destination           Protocol Length Info
     54 1.230468       149.154.167.50        192.168.0.103         SSL      734    Continuation Data

Frame 54: 734 bytes on wire (5872 bits), 734 bytes captured (5872 bits) on interface en0, id 0
Ethernet II, Src: Tp-LinkT_55:94:64 (14:cc:20:55:94:64), Dst: Apple_d6:45:86 (a4:d1:8c:d6:45:86)
Internet Protocol Version 4, Src: 149.154.167.50, Dst: 192.168.0.103
Transmission Control Protocol, Src Port: 443, Dst Port: 52429, Seq: 7365, Ack: 2036, Len: 668
[2 Reassembled TCP Segments (672 bytes): #52(4), #54(668)]
Transport Layer Security

No.     Time           Source                Destination           Protocol Length Info
     55 1.230598       192.168.0.103         149.154.167.50        TCP      66     52429 → 443 [ACK] Seq=2036 Ack=8033 Win=2037 Len=0 TSval=2136815237 TSecr=909502867

Frame 55: 66 bytes on wire (528 bits), 66 bytes captured (528 bits) on interface en0, id 0
Ethernet II, Src: Apple_d6:45:86 (a4:d1:8c:d6:45:86), Dst: Tp-LinkT_55:94:64 (14:cc:20:55:94:64)
Internet Protocol Version 4, Src: 192.168.0.103, Dst: 149.154.167.50
Transmission Control Protocol, Src Port: 52429, Dst Port: 443, Seq: 2036, Ack: 8033, Len: 0

No.     Time           Source                Destination           Protocol Length Info
     56 1.232784       192.168.0.103         149.154.167.50        SSL      219    Continuation Data

Frame 56: 219 bytes on wire (1752 bits), 219 bytes captured (1752 bits) on interface en0, id 0
Ethernet II, Src: Apple_d6:45:86 (a4:d1:8c:d6:45:86), Dst: Tp-LinkT_55:94:64 (14:cc:20:55:94:64)
Internet Protocol Version 4, Src: 192.168.0.103, Dst: 149.154.167.50
Transmission Control Protocol, Src Port: 52429, Dst Port: 443, Seq: 2036, Ack: 8033, Len: 153
Transport Layer Security

No.     Time           Source                Destination           Protocol Length Info
     57 1.349482       149.154.167.50        192.168.0.103         TCP      70     443 → 52429 [PSH, ACK] Seq=8033 Ack=2189 Win=32768 Len=4 TSval=909502980 TSecr=2136815239 [TCP segment of a reassembled PDU]

Frame 57: 70 bytes on wire (560 bits), 70 bytes captured (560 bits) on interface en0, id 0
Ethernet II, Src: Tp-LinkT_55:94:64 (14:cc:20:55:94:64), Dst: Apple_d6:45:86 (a4:d1:8c:d6:45:86)
Internet Protocol Version 4, Src: 149.154.167.50, Dst: 192.168.0.103
Transmission Control Protocol, Src Port: 443, Dst Port: 52429, Seq: 8033, Ack: 2189, Len: 4

No.     Time           Source                Destination           Protocol Length Info
     58 1.349617       192.168.0.103         149.154.167.50        TCP      66     52429 → 443 [ACK] Seq=2189 Ack=8037 Win=2047 Len=0 TSval=2136815355 TSecr=909502980

Frame 58: 66 bytes on wire (528 bits), 66 bytes captured (528 bits) on interface en0, id 0
Ethernet II, Src: Apple_d6:45:86 (a4:d1:8c:d6:45:86), Dst: Tp-LinkT_55:94:64 (14:cc:20:55:94:64)
Internet Protocol Version 4, Src: 192.168.0.103, Dst: 149.154.167.50
Transmission Control Protocol, Src Port: 52429, Dst Port: 443, Seq: 2189, Ack: 8037, Len: 0

No.     Time           Source                Destination           Protocol Length Info
     59 1.372224       149.154.167.50        192.168.0.103         TCP      862    443 → 52429 [PSH, ACK] Seq=8037 Ack=2189 Win=32768 Len=796 TSval=909502996 TSecr=2136815239

Frame 59: 862 bytes on wire (6896 bits), 862 bytes captured (6896 bits) on interface en0, id 0
Ethernet II, Src: Tp-LinkT_55:94:64 (14:cc:20:55:94:64), Dst: Apple_d6:45:86 (a4:d1:8c:d6:45:86)
Internet Protocol Version 4, Src: 149.154.167.50, Dst: 192.168.0.103
Transmission Control Protocol, Src Port: 443, Dst Port: 52429, Seq: 8037, Ack: 2189, Len: 796
[2 Reassembled TCP Segments (800 bytes): #57(4), #59(796)]
Data (800 bytes)

0000  36 3a 30 6e c6 16 94 0c 17 84 15 5c 11 1f 4d 72   6:0n.......\..Mr
0010  32 f5 0b e5 87 4d 94 f1 53 80 9d 84 22 e7 ae bb   2....M..S..."...
0020  40 7c 9c 1b f2 4b 42 ab 1b b5 ce 7a 4b 11 ec f2   @|...KB....zK...
0030  f8 5b 83 50 fb 12 0c 50 3c 17 27 2f 31 4d d6 62   .[.P...P<.'/1M.b
0040  8f 0e 56 cb 38 db 11 23 22 34 de dd 51 c8 2f d9   ..V.8..#"4..Q./.
0050  67 5d df e1 39 45 9c 12 36 2d 92 25 90 a0 b4 9d   g]..9E..6-.%....
0060  8a 63 7f 9c 0d a2 21 3d 12 ea b7 9d e5 f6 c4 f8   .c....!=........
0070  93 53 96 27 73 03 8f 20 a9 66 f7 07 5e 11 1b 0c   .S.'s.. .f..^...
0080  d9 be cd d8 01 e8 ad be 6a 71 1a fd d2 b1 3b 58   ........jq....;X
0090  f8 45 77 e5 76 5f 3e 36 a3 3d 57 9c a3 f9 71 a4   .Ew.v_>6.=W...q.
00a0  5c 9c 7e 0c 2f ad 55 20 e9 81 2a cd dd b2 ed c2   \.~./.U ..*.....
00b0  63 96 7c 6a b4 b1 14 24 86 7a 6d f7 3b fc a8 b3   c.|j...$.zm.;...
00c0  1e 21 90 9e f1 d7 46 2b b2 88 1b d7 08 3a 0a 3b   .!....F+.....:.;
00d0  e6 5f 8f 9b 2a 8f 4b 59 05 89 4a 5c 9b 39 e9 76   ._..*.KY..J\.9.v
00e0  ed fb ee 5c 6b 50 57 ef 1e 39 42 31 fc cc 62 25   ...\kPW..9B1..b%
00f0  20 b2 05 67 a4 06 27 3c 6e 88 bb 2c 5c 6a 59 6c    ..g..'<n..,\jYl
0100  7c 66 8f 33 f4 36 2e 71 6d cd 45 23 46 31 6f 5a   |f.3.6.qm.E#F1oZ
0110  df b7 a2 45 fa 7e e7 e7 0d 58 9d 60 ac 6c 92 28   ...E.~...X.`.l.(
0120  ea 9c da c5 90 93 85 1d ce a3 59 86 fe e1 3d 4b   ..........Y...=K
0130  d5 a8 27 30 2f 45 12 fa d5 33 5d 3d 3a 39 14 75   ..'0/E...3]=:9.u
0140  8d f3 ec b0 55 3b 90 09 79 ed ed 37 c0 a3 16 8c   ....U;..y..7....
0150  ee 6d ab fe 76 f4 bc 3e 23 35 65 29 cb 54 55 b9   .m..v..>#5e).TU.
0160  37 5f cd 4d 70 5e 71 db 24 a8 32 16 02 17 f5 96   7_.Mp^q.$.2.....
0170  81 75 21 c6 61 08 74 0b ab 20 ef d9 4f 32 c6 f4   .u!.a.t.. ..O2..
0180  62 69 a4 cc 21 42 64 90 7d 7d cf 32 77 68 cb 75   bi..!Bd.}}.2wh.u
0190  df ff 14 9b a0 06 0e ba da ae a1 24 9a 33 1e c5   ...........$.3..
01a0  16 f3 4f 65 8b 5e 24 2d 18 49 18 d8 f5 88 e9 df   ..Oe.^$-.I......
01b0  7e d2 62 10 33 31 6a c3 d9 36 b5 0a 68 0f 59 0e   ~.b.31j..6..h.Y.
01c0  02 77 9d 8d 53 d6 de ae 49 52 35 78 a2 23 8a 3d   .w..S...IR5x.#.=
01d0  36 1e 1f c8 16 09 5d bb d3 2c e5 99 93 b3 d8 c2   6.....]..,......
01e0  9a e5 ab e8 c7 90 0e 9d 75 1b fe 4e 12 c9 fd 3e   ........u..N...>
01f0  ec 42 ad b1 f2 7c e4 71 5c a4 d0 82 ee 46 b2 1e   .B...|.q\....F..
0200  7e c9 29 9b 86 92 4a a5 16 ff fc a2 ad 7c ae 09   ~.)...J......|..
0210  92 96 9b 15 c1 17 0b 52 62 33 25 9a 68 2e 38 b7   .......Rb3%.h.8.
0220  43 2f e9 b8 91 51 32 14 60 82 16 50 a7 bd a9 c4   C/...Q2.`..P....
0230  d0 3e 14 b5 af 81 85 b6 d2 0d 62 9a 16 ae 97 85   .>........b.....
0240  38 13 a6 69 09 9b 26 49 57 db c8 1c b8 97 87 c0   8..i..&IW.......
0250  1b 5d ca f6 ef 25 d9 63 3f d9 e4 cc 0c 61 44 cb   .]...%.c?....aD.
0260  33 e5 aa a9 cf 99 dd 81 72 72 1c af bb a5 05 ca   3.......rr......
0270  fe fe 55 e9 e4 1a 64 e3 e5 38 05 1d f5 90 f3 1b   ..U...d..8......
0280  a3 90 fa da 50 fa c3 4e 8f b7 12 db 57 6c de 67   ....P..N....Wl.g
0290  fb a0 ef 98 e0 dd c3 bd 81 8f 60 e8 55 24 2d b7   ..........`.U$-.
02a0  0f a1 b1 30 bf 69 43 22 3e 67 bf a9 91 82 87 26   ...0.iC">g.....&
02b0  0b 59 69 4d b8 0a 8c 75 b5 a8 63 17 2d b1 e1 aa   .YiM...u..c.-...
02c0  0a 65 91 94 f0 04 03 ad 67 1b 62 27 30 c6 8a 78   .e......g.b'0..x
02d0  c4 c4 5d 87 78 d1 93 d3 c0 5b e1 a4 7d 75 f1 01   ..].x....[..}u..
02e0  12 a6 b3 d8 8a 7c 05 26 64 66 ef 18 cf 02 0a 23   .....|.&df.....#
02f0  e4 a1 dc 08 c7 b8 5d 1f d7 da 06 a5 08 08 d3 1b   ......].........
0300  a1 f1 61 c3 27 92 c2 3f e7 67 09 f1 fe ce 79 5e   ..a.'..?.g....y^
0310  41 03 71 cc d1 bb ef f0 ad 7f 88 77 65 d5 b8 dc   A.q........we...

No.     Time           Source                Destination           Protocol Length Info
